,raw text,train text,category
965,Saya manusia yang penuh dengan kesilapan,"[('saya', 'PRON'), ('manusia', 'NOUN'), ('yang', 'PRON'), ('penuh', 'ADJ'), ('deng', 'NOUN'), ('silap', 'NOUN')]",non-deppressive
966, Saya ingin kembali menjadi seorang isteri yang solehah yang sentiasa mendoakan suaminya,"[('saya', 'PRON'), ('ingin', 'ADV'), ('kembali', 'ADV'), ('jadi', 'VERB'), ('orang', 'DET'), ('isteri', 'NOUN'), ('yang', 'PRON'), ('solehah', 'ADJ'), ('yang', 'PRON'), ('sentiasa', 'VERB'), ('mendoa', 'VERB'), ('suami', 'NOUN')]",non-deppressive
967, Saya rasa berdosa,"[('saya', 'PRON'), ('rasa', 'VERB'), ('dosa', 'ADJ')]",non-deppressive
968, Saya rasa jahat dan kejam kerana dengan keadaan kemurungan ini telah memberi kesan yang tidak baik terhadap orang sekeliling terutamanya keluarga terdekat,"[('saya', 'PRON'), ('rasa', 'VERB'), ('jahat', 'ADJ'), ('dan', 'CCONJ'), ('kejam', 'ADJ'), ('rana', 'SCONJ'), ('deng', 'NOUN'), ('ada', 'NOUN'), ('murung', 'NOUN'), ('ini', 'DET'), ('te', 'PROPN'), ('beri', 'VERB'), ('kes', 'NOUN'), ('yang', 'PRON'), ('tidak', 'PART'), ('baik', 'ADJ'), ('hadap', 'ADP'), ('orang', 'NOUN'), ('keliling', 'NOUN'), ('terutama', 'ADV'), ('keluarga', 'NOUN'), ('dekat', 'ADJ')]",symptom
969,"Saya cemburu melihat isteri solehah yg meletakkan niqab di atas mukanya,berjalan penuh keyakinan","[('saya', 'PRON'), ('cemburu', 'ADJ'), ('lihat', 'VERB'), ('isteri', 'NOUN'), ('solehah', 'ADJ'), ('yang', 'PRON'), ('letak', 'VERB'), ('niqab', 'NOUN'), ('di', 'ADP'), ('atas', 'ADP'), ('muka', 'NOUN'), ('jal', 'VERB'), ('penuh', 'ADJ'), ('yakin', 'NOUN')]",non-deppressive
970, Tak mengharapkan apa apa daripada manusia,"[('tidak', 'ADV'), ('harap', 'VERB'), ('apa', 'PRON'), ('apa', 'PRON'), ('daripada', 'ADP'), ('manusia', 'NOUN')]",non-deppressive
971, Hanya Allah tempat bergantung semata mata,"[('ha', 'PROPN'), ('allah', 'PROPN'), ('tempat', 'NOUN'), ('gantung', 'VERB'), ('semata', 'NOUN'), ('mata', 'NOUN')]",non-deppressive
972, Saya cemburu melihat kekuatan seorang wanita yang bergelar suri rumah,"[('saya', 'PRON'), ('cemburu', 'ADJ'), ('lihat', 'VERB'), ('kuat', 'NOUN'), ('orang', 'DET'), ('wan', 'NOUN'), ('yang', 'PRON'), ('gelar', 'VERB'), ('suri', 'NOUN'), ('rumah', 'NOUN')]",non-deppressive
973, Saya cemburu melihat kebahagiaan rumah tangga,"[('saya', 'PRON'), ('cemburu', 'ADJ'), ('lihat', 'VERB'), ('bahagia', 'NOUN'), ('rumah', 'NOUN'), ('tangga', 'NOUN')]",non-deppressive
974,Kini saya ingin bangun melawan segala hasutan syaitan,"[('kini', 'ADV'), ('saya', 'PRON'), ('ingin', 'ADV'), ('bangun', 'VERB'), ('mela', 'VERB'), ('segala', 'DET'), ('hasut', 'NOUN'), ('syait', 'NOUN')]",non-deppressive
975, Kini saya ingin keluar daripada segala kemurungan dan ingin menjadi seorang isteri solehah yg sentiasa memaafkan dan memberi pedoman,"[('kini', 'ADV'), ('saya', 'PRON'), ('ingin', 'ADV'), ('keluar', 'VERB'), ('daripada', 'ADP'), ('segala', 'DET'), ('murung', 'NOUN'), ('dan', 'CCONJ'), ('ingin', 'ADV'), ('jadi', 'VERB'), ('orang', 'DET'), ('isteri', 'NOUN'), ('solehah', 'ADJ'), ('yang', 'PRON'), ('sentiasa', 'ADV'), ('memuefa', 'VERB'), ('dan', 'CCONJ'), ('beri', 'VERB'), ('pedom', 'NOUN')]",non-deppressive
976, Saya tahu ramai yang mengalami situasi ini tapi,"[('saya', 'PRON'), ('tahu', 'VERB'), ('ramai', 'ADJ'), ('yang', 'PRON'), ('alami', 'VERB'), ('situasi', 'NOUN'), ('ini', 'DET'), ('tetapi', 'CCONJ')]",non-deppressive
977,tak terungkap dengan luahan kata kata apa yang dilaluinya,"[('tidak', 'PART'), ('terungkap', 'VERB'), ('deng', 'DET'), ('luah', 'NOUN'), ('kata', 'NOUN'), ('kata', 'NOUN'), ('apa', 'PRON'), ('yang', 'PRON'), ('lalu', 'VERB')]",non-deppressive
978,Terima kasih kepada pembaca,"[('terima', 'VERB'), ('kasih', 'NOUN'), ('kepada', 'ADP'), ('baca', 'NOUN')]",non-deppressive
979, Saya mengharapkan secebis doa daripada kalian supaya hati ini kembali kuat dan teguh apabila diuji,"[('saya', 'PRON'), ('harap', 'VERB'), ('cebis', 'NOUN'), ('doa', 'NOUN'), ('daripada', 'ADP'), ('kalian', 'PRON'), ('supaya', 'SCONJ'), ('hati', 'NOUN'), ('ini', 'DET'), ('kembali', 'ADV'), ('kuat', 'ADJ'), ('dan', 'CCONJ'), ('teguh', 'ADJ'), ('apabila', 'SCONJ'), ('uji', 'VERB')]",non-deppressive
980, Sokongan dan pemahaman amat diperlukan pada saat ini,"[('sokong', 'NOUN'), ('dan', 'CCONJ'), ('paham', 'NOUN'), ('amat', 'ADV'), ('diperlu', 'VERB'), ('pada', 'ADP'), ('saat', 'NOUN'), ('ini', 'DET')]",non-deppressive
981,Semoga kita menjadi umat yg kuat diakhir zaman ini,"[('moga', 'NOUN'), ('k', 'NOUN'), ('jadi', 'VERB'), ('umat', 'NOUN'), ('yang', 'PRON'), ('kuat', 'ADJ'), ('akhir', 'ADP'), ('zaman', 'NOUN'), ('ini', 'DET')]",non-deppressive
982,– IntanHantar confession anda di sini -> www,"[('angan', 'PUNCT'), ('intanhantar', 'NOUN'), ('pengi', 'NOUN'), ('anda', 'PRON'), ('di', 'ADP'), ('sini', 'NOUN'), ('w', 'X')]",non-deppressive
983,iiumc,"[('iium', 'PROPN')]",non-deppressive
984,com/submit,"[('com', 'PROPN'), ('muka', 'VERB')]",non-deppressive
985,"Assalamualaikum, terima kasih admin kerana approve hantaran ini","[('assalamualaikum', 'ADJ'), ('terima', 'VERB'), ('kasih', 'ADJ'), ('admin', 'NOUN'), ('rana', 'SCONJ'), ('approve', 'VERB'), ('hantar', 'VERB'), ('ini', 'DET')]",non-deppressive
986,Semalam terkejut sangat sebab jumpa post yang seakan-akan melabel pesakit depression sebagai kufur,"[('malam', 'NOUN'), ('kejut', 'VERB'), ('sangat', 'ADV'), ('sebab', 'SCONJ'), ('jumpa', 'VERB'), ('jawat', 'NOUN'), ('yang', 'PRON'), ('sea', 'PROPN'), ('akan', 'ADV'), ('label', 'VERB'), ('sakit', 'NOUN'), ('murung', 'NOUN'), ('bagai', 'ADP'), ('kufur', 'NOUN')]",non-deppressive
987," Bukan itu sahaja, beliau malah menggunakan ayat Quran untuk justify pandangan tersebut","[('bu', 'NOUN'), ('itu', 'DET'), ('sahaja', 'ADV'), ('beliau', 'PRON'), ('ma', 'PROPN'), ('guna', 'VERB'), ('ayat', 'NOUN'), ('qur', 'PROPN'), ('untuk', 'ADP'), ('justify', 'NOUN'), ('pandang', 'NOUN'), ('sebut', 'DET')]",non-deppressive
988,Siapa kita untuk menghukum orang lain? Kita bukanlah antara golongan yang dijamin syurga,"[('siapa', 'PRON'), ('k', 'PROPN'), ('untuk', 'ADP'), ('hukum', 'VERB'), ('orang', 'NOUN'), ('lain', 'ADJ'), ('k', 'PROPN'), ('bu', 'NOUN'), ('antara', 'ADP'), ('golong', 'NOUN'), ('yang', 'PRON'), ('jamin', 'VERB'), ('syurga', 'NOUN')]",non-deppressive
989, Tidak adil untuk pukul rata semua pesakit depression tu kufur,"[('tidak', 'PART'), ('adil', 'ADJ'), ('untuk', 'ADP'), ('pukul', 'NOUN'), ('rata', 'ADJ'), ('semua', 'DET'), ('sakit', 'NOUN'), ('murung', 'NOUN'), ('itu', 'DET'), ('kufur', 'ADJ')]",non-deppressive
990, Malah islam tidak mengajar kita untuk menhukum orang lain,"[('ma', 'PROPN'), ('islam', 'PROPN'), ('tidak', 'PART'), ('ajar', 'VERB'), ('k', 'NOUN'), ('untuk', 'ADP'), ('menhukum', 'VERB'), ('orang', 'NOUN'), ('lain', 'ADJ')]",non-deppressive
991,Stigma sebegini sangat bahaya,"[('stigma', 'NOUN'), ('begini', 'DET'), ('sangat', 'ADV'), ('bahaya', 'NOUN')]",non-deppressive
992," Boleh menyebabkan pesakit kemurungan tidak mahu berkongsi rasa, malah ada yang mungkin tidak mendapatkan rawatan kerana risau dihukum sebagai “kufur”, “jauh dari Tuhan”, “lemah iman” dan sebagainya","[('boleh', 'ADV'), ('sebab', 'VERB'), ('sakit', 'NOUN'), ('murung', 'NOUN'), ('tidak', 'PART'), ('mahu', 'ADV'), ('kongsi', 'VERB'), ('rasa', 'NOUN'), ('ma', 'NOUN'), ('ada', 'VERB'), ('yang', 'PRON'), ('mungkin', 'ADV'), ('tidak', 'PART'), ('dapat', 'VERB'), ('rawat', 'NOUN'), ('rana', 'SCONJ'), ('risau', 'ADJ'), ('hukum', 'VERB'), ('bagai', 'ADP'), ('kufur', 'NOUN'), ('jauh', 'ADJ'), ('dari', 'ADP'), ('tuh', 'DET'), ('lemah', 'ADJ'), ('im', 'NOUN'), ('dan', 'CCONJ'), ('bagai', 'ADP')]",non-deppressive
993,Sedangkan depression tu merupakan satu penyakit dan boleh dirawat,"[('sedang', 'ADV'), ('murung', 'VERB'), ('itu', 'DET'), ('rupa', 'VERB'), ('satu', 'DET'), ('sakit', 'NOUN'), ('dan', 'CCONJ'), ('boleh', 'ADV'), ('rawat', 'VERB')]",non-deppressive
994," Seperti penyakit-penyakit lain, depression juga disebabkan beberapa faktor seperti hormon, genetik, dan persekitaran","[('seperti', 'ADP'), ('sakit', 'NOUN'), ('sakit', 'NOUN'), ('lain', 'ADJ'), ('murung', 'NOUN'), ('juga', 'ADV'), ('sebab', 'VERB'), ('beberapa', 'DET'), ('faktor', 'NOUN'), ('seperti', 'ADP'), ('hormon', 'NOUN'), ('genetik', 'NOUN'), ('dan', 'CCONJ'), ('sekitar', 'NOUN')]",non-deppressive
995, Barah bukan disebabkan kufur kan? Haa macam tu jugak la depression,"[('barah', 'NOUN'), ('bu', 'NOUN'), ('sebab', 'VERB'), ('kufur', 'VERB'), ('kan', 'PROPN'), ('ha', 'ADV'), ('macam', 'NOUN'), ('itu', 'DET'), ('juga', 'ADV'), ('murung', 'NOUN')]",non-deppressive
996,"Mungkin lepas baca luahan ni, ada yang akan kata “betullah kalau dekat dengan Allah takkan depress”","[('mungkin', 'ADV'), ('lepas', 'ADP'), ('baca', 'ADP'), ('luah', 'NOUN'), ('ini', 'DET'), ('ada', 'VERB'), ('yang', 'PRON'), ('akan', 'ADV'), ('kata', 'VERB'), ('betul', 'ADJ'), ('kalau', 'SCONJ'), ('dekat', 'ADJ'), ('deng', 'NOUN'), ('allah', 'PROPN'), ('tidak', 'PART'), ('akan', 'ADV'), ('depress', 'ADJ')]",non-deppressive
997, Tapi sebelum tu saya nak kata yang pandangan itu sangat salah,"[('tetapi', 'CCONJ'), ('belum', 'ADP'), ('itu', 'DET'), ('saya', 'PRON'), ('nak', 'VERB'), ('kata', 'NOUN'), ('yang', 'PRON'), ('pandang', 'VERB'), ('itu', 'DET'), ('sangat', 'ADV'), ('sa', 'ADJ')]",non-deppressive
998, Dan merupakan stigma yang sangat berat,"[('dan', 'CCONJ'), ('rupa', 'VERB'), ('stigma', 'NOUN'), ('yang', 'PRON'), ('sangat', 'ADV'), ('berat', 'ADJ')]",non-deppressive
999,"Haah, betul dengan mendekatkan diri dengan Allah, kita boleh tenang dan hilang tekanan, tetapi perlu ingat, depression ini penyakit","[('haah', 'ADV'), ('betul', 'ADJ'), ('deng', 'DET'), ('dekat', 'VERB'), ('diri', 'NOUN'), ('deng', 'PROPN'), ('allah', 'PROPN'), ('k', 'PROPN'), ('boleh', 'ADV'), ('tenang', 'ADJ'), ('dan', 'CCONJ'), ('hilang', 'VERB'), ('tekan', 'NOUN'), ('tetapi', 'SCONJ'), ('perlu', 'ADV'), ('ingat', 'VERB'), ('murung', 'NOUN'), ('ini', 'DET'), ('sakit', 'NOUN')]",non-deppressive
1000," Dekatkan diri dengan Allah tu perlu, tetapi perlu juga mendapatkan rawatan pakar","[('dekat', 'ADJ'), ('diri', 'NOUN'), ('deng', 'NOUN'), ('allah', 'PROPN'), ('itu', 'DET'), ('perlu', 'ADV'), ('tetapi', 'SCONJ'), ('perlu', 'ADV'), ('juga', 'ADV'), ('dapat', 'VERB'), ('rawat', 'NOUN'), ('pakar', 'NOUN')]",non-deppressive
1001," Antara rawatan yang akan diberi adalah ubatan, terapi atau kedua-dua sekali bergantung pada keadaan pesakit","[('antara', 'ADP'), ('rawat', 'NOUN'), ('yang', 'PRON'), ('akan', 'ADV'), ('beri', 'VERB'), ('ada', 'VERB'), ('ubat', 'NOUN'), ('terapi', 'NOUN'), ('atau', 'CCONJ'), ('dua', 'NUM'), ('dua', 'NUM'), ('sekali', 'ADV'), ('gantung', 'VERB'), ('pada', 'ADP'), ('ada', 'NOUN'), ('sakit', 'NOUN')]",non-deppressive
1002,"Tapi macam mana orang yang sedang depress nak mendapatkan rawatan jika sekali diluahkan perasaan, terus dicop lemah iman dan sebagainya","[('tetapi', 'CCONJ'), ('macam', 'ADP'), ('mana', 'NOUN'), ('orang', 'NOUN'), ('yang', 'PRON'), ('sedang', 'ADV'), ('depress', 'ADJ'), ('nak', 'ADV'), ('dapat', 'VERB'), ('rawat', 'NOUN'), ('jika', 'SCONJ'), ('sekali', 'ADV'), ('luah', 'VERB'), ('asa', 'NOUN'), ('terus', 'ADV'), ('cop', 'VERB'), ('lemah', 'ADJ'), ('im', 'NOUN'), ('dan', 'CCONJ'), ('bagai', 'ADP')]",non-deppressive
1003, Sedangkan kita dituntut untuk merujuk pakar dan berusaha dalam bertawakal,"[('sedang', 'ADV'), ('k', 'NOUN'), ('tuntut', 'VERB'), ('untuk', 'ADP'), ('rujuk', 'VERB'), ('pakar', 'NOUN'), ('dan', 'CCONJ'), ('berusaha', 'VERB'), ('dalam', 'ADP'), ('tawakal', 'VERB')]",non-deppressive
1004,  Stigma sebegini la juga yang menjauhkan orang-orang dari orang alim,"[('stigma', 'NOUN'), ('begini', 'DET'), ('juga', 'ADV'), ('yang', 'PRON'), ('jauh', 'VERB'), ('orang', 'NOUN'), ('orang', 'NOUN'), ('dari', 'ADP'), ('orang', 'NOUN'), ('alim', 'NOUN')]",non-deppressive
1005," Bukankah ini merugikan Islam tu sendiri? Pesakit depression perlukan harapan dan bantuan, bukan kecaman","[('bukan', 'PART'), ('ini', 'DET'), ('merugi', 'VERB'), ('islam', 'NOUN'), ('itu', 'DET'), ('sendiri', 'DET'), ('sakit', 'NOUN'), ('murung', 'NOUN'), ('perlu', 'ADV'), ('harap', 'VERB'), ('dan', 'CCONJ'), ('bantu', 'NOUN'), ('bu', 'NOUN'), ('kecam', 'NOUN')]",non-deppressive
1006,"Apa kesan stigma ini?Seperti yang dinyataan diatas, dan kesannya bukan sekadar menyebabkan pesakit tidak mendapatkan bantuan, malah kalau keadaan makin teruk boleh menyebabkan pesakit bunuh diri (nauzubillah)","[('apa', 'PRON'), ('kes', 'NOUN'), ('stigma', 'NOUN'), ('ini', 'DET'), ('seperti', 'ADP'), ('yang', 'PRON'), ('nyata', 'VERB'), ('atas', 'ADP'), ('dan', 'CCONJ'), ('kesan', 'NOUN'), ('bu', 'NOUN'), ('sekadar', 'ADV'), ('sebab', 'VERB'), ('sakit', 'NOUN'), ('tidak', 'PART'), ('dapat', 'VERB'), ('bantu', 'NOUN'), ('ma', 'PROPN'), ('kalau', 'SCONJ'), ('ada', 'NOUN'), ('makin', 'ADV'), ('teruk', 'ADJ'), ('boleh', 'ADV'), ('sebab', 'VERB'), ('sakit', 'NOUN'), ('bunuh', 'VERB'), ('diri', 'NOUN'), ('nauzubil', 'ADJ')]",non-deppressive
1007,"Jika pandangan-pandangan yang melabel pesakit depression ni tersebar, dan pesakit triggered, boleh membuatkan pesakit self-blame, adakah kita akan bertanggungjawab? Self-blame, rasa diri tidak berguna, rasa diri tiada harapan juga boleh mengakibatkan pesakit bunuh diri","[('jika', 'SCONJ'), ('pandang', 'NOUN'), ('pandang', 'NOUN'), ('yang', 'PRON'), ('label', 'VERB'), ('sakit', 'NOUN'), ('murung', 'NOUN'), ('ini', 'DET'), ('sebar', 'VERB'), ('dan', 'CCONJ'), ('sakit', 'NOUN'), ('cetus', 'NOUN'), ('boleh', 'ADV'), ('buat', 'VERB'), ('sakit', 'NOUN'), ('diri', 'NOUN'), ('sendiri', 'ADJ'), ('salah', 'VERB'), ('ada', 'VERB'), ('k', 'NOUN'), ('akan', 'ADV'), ('bertanggungjawab', 'VERB'), ('diri', 'NOUN'), ('sendiri', 'ADJ'), ('salah', 'VERB'), ('rasa', 'NOUN'), ('diri', 'NOUN'), ('tidak', 'PART'), ('guna', 'VERB'), ('rasa', 'NOUN'), ('diri', 'NOUN'), ('tiada', 'PART'), ('harap', 'SCONJ'), ('juga', 'ADV'), ('boleh', 'ADV'), ('akibat', 'VERB'), ('sakit', 'NOUN'), ('bunuh', 'NOUN'), ('diri', 'NOUN')]",non-deppressive
1008,Penyakit depression ni semakin hari semakin merunsingkan,"[('sakit', 'NOUN'), ('murung', 'NOUN'), ('ini', 'DET'), ('makin', 'ADV'), ('hari', 'NOUN'), ('makin', 'ADV'), ('merunsing', 'ADJ')]",non-deppressive
1009," Selain rawatan doktor psikiatri atau psikologis, sokongan daripada individu sekeliling sangat lah penting","[('selain', 'ADP'), ('rawat', 'NOUN'), ('doktor', 'NOUN'), ('psikiatri', 'NOUN'), ('atau', 'CCONJ'), ('psikologi', 'NOUN'), ('sokong', 'NOUN'), ('daripada', 'ADP'), ('individu', 'NOUN'), ('keliling', 'NOUN'), ('sangat', 'ADV'), ('penting', 'ADJ')]",non-deppressive
1010, Antara gejala depression adalah merasa diri tidak berguna,"[('antara', 'ADP'), ('gejala', 'NOUN'), ('murung', 'NOUN'), ('ada', 'VERB'), ('rasa', 'VERB'), ('diri', 'NOUN'), ('tidak', 'PART'), ('guna', 'VERB')]",symptom
1011,"Jadi kita sebagai anggota masyarakat perlu memberi harapan yang mereka sangat diperlukan, dan diri mereka bernilai","[('jadi', 'VERB'), ('k', 'NOUN'), ('bagai', 'ADP'), ('anggota', 'NOUN'), ('masyarakat', 'NOUN'), ('perlu', 'ADV'), ('beri', 'VERB'), ('harap', 'VERB'), ('yang', 'PRON'), ('mereka', 'PRON'), ('sangat', 'ADV'), ('diperlu', 'VERB'), ('dan', 'CCONJ'), ('diri', 'NOUN'), ('mereka', 'PRON'), ('nila', 'VERB')]",non-deppressive
1012, Teruskan berdoa semoga kita tidak mendapat depression,"[('terus', 'ADV'), ('doa', 'VERB'), ('moga', 'SCONJ'), ('k', 'NOUN'), ('tidak', 'PART'), ('dapat', 'VERB'), ('murung', 'NOUN')]",non-deppressive
1013, Dan dalam masa yang sama mendoakan sahabat kita yang sedang bertarung dengan depression dan lain-lain penyakit mental,"[('dan', 'CCONJ'), ('dalam', 'ADP'), ('masa', 'NOUN'), ('yang', 'PRON'), ('sama', 'ADJ'), ('mendoa', 'VERB'), ('sahabat', 'NOUN'), ('k', 'PROPN'), ('yang', 'PRON'), ('sedang', 'ADV'), ('tarung', 'VERB'), ('deng', 'NOUN'), ('murung', 'NOUN'), ('dan', 'CCONJ'), ('lain', 'ADJ'), ('lain', 'ADJ'), ('sakit', 'NOUN'), ('mental', 'ADJ')]",non-deppressive
1014,– Zinnirah (Bukan nama sebenar)Hantar confession anda di sini -> https://iiumc,"[('angan', 'PUNCT'), ('zinnirah', 'NOUN'), ('bu', 'NOUN'), ('nama', 'NOUN'), ('benar', 'ADJ'), ('hantar', 'VERB'), ('pengi', 'NOUN'), ('anda', 'PRON'), ('di', 'ADP'), ('sini', 'ADP'), ('htps', 'NOUN'), ('iium', 'PROPN')]",non-deppressive
1015,com/submit,"[('com', 'PROPN'), ('muka', 'VERB')]",non-deppressive
1016,Hai assalamualaikum nama mia ( bukan nama sebenar) 15 tahun,"[('hai', 'PART'), ('assalamualaikum', 'NOUN'), ('nama', 'NOUN'), ('mia', 'NOUN'), ('bu', 'NOUN'), ('nama', 'NOUN'), ('benar', 'ADJ'), ('lima', 'NUM'), ('belas', 'NUM'), ('tahun', 'NOUN')]",non-deppressive
1017, saya ada satu perasaan yang saya sendiri tak tahu itu apa,"[('saya', 'PRON'), ('ada', 'VERB'), ('satu', 'DET'), ('asa', 'NOUN'), ('yang', 'PRON'), ('saya', 'PRON'), ('sendiri', 'ADV'), ('tidak', 'ADV'), ('tahu', 'VERB'), ('itu', 'DET'), ('apa', 'PRON')]",non-deppressive
1018, Then saya ade research membawa kepada di bawah ini,"[('kemudi', 'NOUN'), ('saya', 'PRON'), ('ada', 'VERB'), ('lidi', 'NOUN'), ('bawa', 'VERB'), ('kepada', 'ADP'), ('di', 'ADP'), ('bawah', 'NOUN'), ('ini', 'DET')]",non-deppressive
1019,Tanda-tanda penyakit kemurungan1,"[('tanda', 'NOUN'), ('tanda', 'NOUN'), ('sakit', 'NOUN'), ('murung', 'NOUN')]",non-deppressive
1020, Perasaan murung atau sering marah-marah hampir sepanjang hari dan hampir setiap hari dalam tempoh dua minggu,"[('asa', 'NOUN'), ('murung', 'NOUN'), ('atau', 'CCONJ'), ('sering', 'ADV'), ('marah', 'ADJ'), ('marah', 'ADJ'), ('hampir', 'ADV'), ('panjang', 'ADP'), ('hari', 'NOUN'), ('dan', 'CCONJ'), ('hampir', 'ADV'), ('tiap', 'DET'), ('hari', 'NOUN'), ('dalam', 'ADP'), ('tempoh', 'NOUN'), ('dua', 'NUM'), ('minggu', 'NOUN')]",symptom
1021, Perasaan ini dilaporkan oleh pesakit secara subjektif seperti perasaan rendah diri ataupun daripada pengamatan orang luar contohnya selalu menangis,"[('asa', 'NOUN'), ('ini', 'DET'), ('lapor', 'VERB'), ('oleh', 'ADP'), ('sakit', 'NOUN'), ('cara', 'ADP'), ('subjektif', 'ADJ'), ('seperti', 'ADP'), ('asa', 'NOUN'), ('rendah', 'NOUN'), ('diri', 'NOUN'), ('atau', 'CCONJ'), ('daripada', 'ADP'), ('amat', 'NOUN'), ('orang', 'NOUN'), ('luar', 'NOUN'), ('contoh', 'NOUN'), ('selalu', 'ADV'), ('menang', 'VERB')]",symptom
1022, ( ok ini memang selalu cth kalau hari tu kena marah or ada orang sumpah seranah even gurau je pon saya boleh dapat perasaan diri rasa ‘xguna’ or benci dekat diri sendiri,"[('okey', 'ADJ'), ('ini', 'DET'), ('memang', 'ADV'), ('selalu', 'ADV'), ('cth', 'VERB'), ('kalau', 'SCONJ'), ('hari', 'NOUN'), ('itu', 'DET'), ('kena', 'VERB'), ('marah', 'VERB'), ('atau', 'CCONJ'), ('ada', 'VERB'), ('orang', 'NOUN'), ('sumah', 'ADV'), ('seranah', 'ADJ'), ('walaupun', 'SCONJ'), ('gurau', 'NOUN'), ('sahaja', 'ADV'), ('pun', 'ADV'), ('saya', 'PRON'), ('boleh', 'ADV'), ('dapat', 'VERB'), ('asa', 'NOUN'), ('diri', 'NOUN'), ('rasa', 'NOUN'), ('tidak', 'PART'), ('guna', 'NOUN'), ('atau', 'CCONJ'), ('benci', 'VERB'), ('dekat', 'ADP'), ('diri', 'NOUN'), ('sendiri', 'ADJ')]",symptom
1023, and macam ada orang bercakap dalam kepala ‘ ko ni tak guan mia benda macam tu pon tak boleh buat ke?’ atau ‘ ko ni tak layak hidup la mia’ atau ‘ semua ni salah ko la mia’ kata- kata tu berlegar dalam kepala walaupun salah yang saya buat alahai sangat sikit,"[('dan', 'CCONJ'), ('macam', 'NOUN'), ('ada', 'VERB'), ('orang', 'NOUN'), ('cakap', 'VERB'), ('dalam', 'ADP'), ('kepala', 'NOUN'), ('kamu', 'PRON'), ('ini', 'DET'), ('tidak', 'PART'), ('guan', 'NOUN'), ('mia', 'NOUN'), ('benda', 'NOUN'), ('macam', 'NOUN'), ('itu', 'DET'), ('pun', 'ADV'), ('tidak', 'PART'), ('boleh', 'ADV'), ('buat', 'VERB'), ('ke', 'ADP'), ('atau', 'CCONJ'), ('kamu', 'PRON'), ('ini', 'DET'), ('tidak', 'PART'), ('layak', 'ADJ'), ('hidup', 'NOUN'), ('mia', 'PROPN'), ('atau', 'CCONJ'), ('semua', 'DET'), ('ini', 'DET'), ('sa', 'NOUN'), ('kamu', 'PRON'), ('mia', 'NOUN'), ('kata', 'NOUN'), ('kata', 'NOUN'), ('itu', 'DET'), ('legar', 'VERB'), ('dalam', 'ADP'), ('kepala', 'NOUN'), ('walaupun', 'SCONJ'), ('sa', 'NOUN'), ('yang', 'PRON'), ('saya', 'PRON'), ('buat', 'VERB'), ('alahai', 'NOUN'), ('sangat', 'ADV'), ('sikit', 'ADJ')]",symptom
1024, Lagi- lagi bila orang salahkan saya depan – depan secara gurauan dia punya feel tu macam dah tak nak buat ape dah,"[('lagi', 'ADV'), ('lagi', 'ADV'), ('bila', 'SCONJ'), ('orang', 'NOUN'), ('salah', 'DET'), ('saya', 'PRON'), ('dep', 'PROPN'), ('angan', 'PUNCT'), ('dep', 'PROPN'), ('cara', 'ADP'), ('gurau', 'NOUN'), ('dia', 'PRON'), ('pu', 'PROPN'), ('rasa', 'NOUN'), ('itu', 'DET'), ('macam', 'ADV'), ('dah', 'ADV'), ('tidak', 'PART'), ('mahu', 'ADV'), ('buat', 'VERB'), ('apa', 'PRON'), ('dah', 'ADV')]",risk factor
1025, Lebih tepat lagi rasa macam tak nak hidup bila ade orang salah kan kita la,"[('lebih', 'ADV'), ('tepat', 'ADJ'), ('lagi', 'ADV'), ('rasa', 'VERB'), ('macam', 'ADP'), ('tidak', 'PART'), ('mahu', 'ADV'), ('hidup', 'VERB'), ('bila', 'SCONJ'), ('ada', 'VERB'), ('orang', 'NOUN'), ('sa', 'PROPN'), ('kan', 'VERB'), ('k', 'PROPN')]",symptom
1026,(nampak remeh kan sorry tak reti nak luahkan macam mana harap faham)2,"[('tampak', 'VERB'), ('remeh', 'ADJ'), ('kan', 'PART'), ('maaf', 'ADJ'), ('tidak', 'PART'), ('reti', 'ADJ'), ('nak', 'ADV'), ('luah', 'VERB'), ('macam', 'NOUN'), ('mana', 'NOUN'), ('harap', 'VERB'), ('faham', 'VERB'), ('dua', 'NUM')]",non-deppressive
1027, Tidak bersemangat atau tidak berminat melakukan aktiviti sosial yang biasa dilakukan hampir setiap hari,"[('tidak', 'PART'), ('semangat', 'ADJ'), ('atau', 'CCONJ'), ('tidak', 'PART'), ('minat', 'VERB'), ('laku', 'ADP'), ('aktiviti', 'NOUN'), ('sosial', 'NOUN'), ('yang', 'PRON'), ('biasa', 'ADV'), ('dila', 'VERB'), ('hampir', 'ADV'), ('tiap', 'DET'), ('hari', 'NOUN')]",symptom
1028, Contohnya tidak berminat untuk bersukan lagi atau berjumpa dengan sanak-saudara,"[('contoh', 'NOUN'), ('tidak', 'PART'), ('minat', 'VERB'), ('untuk', 'ADP'), ('bersu', 'VERB'), ('lagi', 'ADV'), ('atau', 'CCONJ'), ('jumpa', 'VERB'), ('deng', 'NOUN'), ('sanak', 'NOUN'), ('saudara', 'NOUN')]",symptom
1029, sangat-sangatlah iye,"[('sangat', 'ADV'), ('sangat', 'ADV'), ('siya', 'NOUN')]",non-deppressive
1030,3,"[('tiga', 'NUM')]",non-deppressive
1031, Berat badan merosot (~5%) daripada asal dalam waktu yang singkat atau kurang selera makan,"[('berat', 'NOUN'), ('badan', 'NOUN'), ('merosot', 'VERB'), ('daripada', 'ADP'), ('asal', 'NOUN'), ('dalam', 'ADP'), ('waktu', 'NOUN'), ('yang', 'PRON'), ('singkat', 'ADJ'), ('atau', 'CCONJ'), ('kurang', 'ADV'), ('selera', 'NOUN'), ('ma', 'PROPN')]",symptom
1032, Yang ni tak kot sebab aq ni jenis banyak memikir bila penat memikir aq makan,"[('yang', 'PRON'), ('ini', 'DET'), ('tidak', 'PART'), ('mungkin', 'ADJ'), ('sebab', 'SCONJ'), ('aku', 'PRON'), ('ini', 'DET'), ('jenis', 'NOUN'), ('banyak', 'ADV'), ('pikir', 'VERB'), ('bila', 'SCONJ'), ('penat', 'NOUN'), ('pikir', 'VERB'), ('aku', 'PRON'), ('ma', 'PROPN')]",symptom
1033,4,"[('empat', 'NUM')]",non-deppressive
1034," Corak tidur berubah, sama ada kurang tidur (insomnia) atau terlebih tidur (hypersomnia)","[('corak', 'NOUN'), ('tidur', 'NOUN'), ('rubah', 'VERB'), ('sama', 'ADV'), ('ada', 'VERB'), ('kurang', 'ADV'), ('tidur', 'VERB'), ('insomnia', 'NOUN'), ('atau', 'CCONJ'), ('lebih', 'ADV'), ('tidur', 'VERB'), ('hypersomnia', 'NOUN')]",symptom
1035,Yang ni sekarang ya,"[('yang', 'PRON'), ('ini', 'DET'), ('sekarang', 'NOUN'), ('ya', 'CCONJ')]",non-deppressive
1036," Tak tahu kenapa aq dari dulu lagi kalau buat ujian yg stress, depression, anxiety","[('tidak', 'ADV'), ('tahu', 'VERB'), ('kenapa', 'ADV'), ('aku', 'PRON'), ('dari', 'ADP'), ('dahulu', 'ADJ'), ('lagi', 'ADV'), ('kalau', 'SCONJ'), ('buat', 'VERB'), ('uji', 'NOUN'), ('yang', 'PRON'), ('stres', 'ADJ'), ('murung', 'VERB'), ('bimbang', 'NOUN')]",non-deppressive
1037, Depression dengan anxiety tahap max nun,"[('murung', 'VERB'), ('deng', 'NOUN'), ('bimbang', 'NOUN'), ('tahap', 'NOUN'), ('max', 'ADJ'), ('biara', 'NOUN')]",non-deppressive
1038, kuat tidoq waktu tu la ni ja tiba-tiba dia berubah,"[('kuat', 'ADJ'), ('tido', 'VERB'), ('waktu', 'NOUN'), ('itu', 'DET'), ('ini', 'DET'), ('sahaja', 'ADV'), ('tiba', 'ADV'), ('tiba', 'ADV'), ('dia', 'PRON'), ('rubah', 'VERB')]",symptom
1039,5,"[('lima', 'NUM')]",non-deppressive
1040," Perubahan dalam melakukan aktiviti seharian, sama ada terlebih aktif atau kurang aktif","[('ubah', 'VERB'), ('dalam', 'ADP'), ('laku', 'VERB'), ('aktiviti', 'NOUN'), ('hari', 'NOUN'), ('sama', 'ADV'), ('ada', 'VERB'), ('lebih', 'ADV'), ('aktif', 'ADJ'), ('atau', 'CCONJ'), ('kurang', 'ADV'), ('aktif', 'ADJ')]",symptom
1041, yup ni ye ( kadang – kadang benci dengan diri sendiri sebab ni)6,"[('ya', 'PART'), ('ini', 'DET'), ('ya', 'PART'), ('kadang', 'ADV'), ('angan', 'PUNCT'), ('kadang', 'ADV'), ('benci', 'VERB'), ('deng', 'NOUN'), ('diri', 'NOUN'), ('sendiri', 'ADJ'), ('sebab', 'CCONJ'), ('ini', 'DET'), ('enam', 'NUM')]",symptom
1042, Selalu letih dan kurang tenaga dalam melakukan aktiviti harian,"[('selalu', 'ADV'), ('letih', 'ADJ'), ('dan', 'CCONJ'), ('kurang', 'VERB'), ('tenaga', 'NOUN'), ('dalam', 'ADP'), ('laku', 'NOUN'), ('aktiviti', 'NOUN'), ('hari', 'NOUN')]",symptom
1043, even sabtu ahad cuti pon rasa tak larat sangat nak buat keje,"[('walaupun', 'SCONJ'), ('sabtu', 'NOUN'), ('ahad', 'ADJ'), ('cuti', 'VERB'), ('pun', 'DET'), ('rasa', 'NOUN'), ('tidak', 'PART'), ('larat', 'ADJ'), ('sangat', 'ADV'), ('nak', 'ADP'), ('buat', 'VERB'), ('kerja', 'NOUN')]",symptom
1044, Rasa letih dia macam orang kemas rumah dari A-Z ,"[('rasa', 'NOUN'), ('letih', 'ADJ'), ('dia', 'PRON'), ('macam', 'ADP'), ('orang', 'NOUN'), ('kemas', 'VERB'), ('rumah', 'NOUN'), ('dari', 'ADP'), ('a', 'PROPN'), ('z', 'PROPN')]",symptom
1045,7,"[('tujuh', 'NUM')]",non-deppressive
