,raw text,token text,category
588, Kau sakit tak semestinya Iman kau lemah tapi tak semestinya juga Iman kau ok,"['kamu', 'sakit', 'tidak', 'semesti', 'im', 'kamu', 'lemah', 'tetapi', 'tidak', 'semesti', 'juga', 'im', 'kamu', 'okey']",non-deppressive
589, Hakikat Iman tu memang naik dan turun ini memang ulama bersepakat tentang hakikat ini,"['hakikat', 'im', 'itu', 'memang', 'naik', 'dan', 'turun', 'ini', 'memang', 'ulama', 'sepakat', 'tentang', 'hakikat', 'ini']",non-deppressive
590, Kau sakit ke sihat ke iman kau memang turun naik,"['kamu', 'sakit', 'ke', 'sihat', 'ke', 'im', 'kamu', 'memang', 'turun', 'naik']",non-deppressive
591," Dan kau sakit ke sihat ke kau sentiasa kena usaha perbaiki iman kau, perbaiki ibadah kau","['dan', 'kamu', 'sakit', 'ke', 'sihat', 'ke', 'kamu', 'sentiasa', 'kena', 'usaha', 'baik', 'im', 'kamu', 'baik', 'ibadah', 'kamu']",non-deppressive
592," Ada kaitan tak dengan kesihatan mental? Bagi aku secara generalnya tidak, tapi dari segenap sudut ada kena mengena juga","['ada', 'kait', 'tidak', 'deng', 'kesihat', 'mental', 'bagi', 'aku', 'cara', 'general', 'tidak', 'tetapi', 'dari', 'segenap', 'sudut', 'ada', 'kena', 'kena', 'juga']",non-deppressive
593,"Maksud aku, stigma yang depression yang PUNCA UTAMA adalah kelemahan iman tu bagi aku salah","['maksud', 'aku', 'stigma', 'yang', 'murung', 'yang', 'punca', 'utama', 'ada', 'lemah', 'im', 'itu', 'bagi', 'aku', 'sa']",non-deppressive
594, Iman ni Allah je yang tahu kat mana levelnya,"['im', 'ini', 'allah', 'sahaja', 'yang', 'tahu', 'dekat', 'mana', 'level']",non-deppressive
595," Aku tak nafi, boleh jadi lemahnya iman tu ANTARA PUNCA kau kemurungan","['aku', 'tidak', 'nafi', 'boleh', 'jadi', 'lemah', 'im', 'itu', 'antara', 'punca', 'kamu', 'murung']",non-deppressive
596," So disebabkan mustahil untuk buktikan kelemahan iman ni punca kemurungan, sebab tu kalau kau cuba ambil langkah-langkah untuk kuatkan iman pun kau still murung","['jadi', 'sebab', 'mustahil', 'untuk', 'bukti', 'lemah', 'im', 'ini', 'punca', 'murung', 'sebab', 'itu', 'kalau', 'kamu', 'cuba', 'ambil', 'lang', 'lang', 'untuk', 'kuat', 'im', 'pun', 'kamu', 'masih', 'ada', 'murung']",medical history
597," Macam aku dulu la, hari-hari baca al-Quran, solat cukup, orang sekeliling pun semua dok mengaji je tapi last2 kemurungan datang balik jugak","['macam', 'aku', 'dahulu', 'hari', 'hari', 'baca', 'al', 'qur', 'solat', 'cukup', 'orang', 'keliling', 'pun', 'semua', 'dok', 'aji', 'sahaja', 'tetapi', 'akhir', 'akhir', 'murung', 'datang', 'balik', 'juga']",medical history
598," Tapi aku tak nafikan, yang aku hafaz al-Quran ni sangat membantu aku","['tetapi', 'aku', 'tidak', 'nafi', 'yang', 'aku', 'hafaz', 'al', 'qur', 'ini', 'sangat', 'bantu', 'aku']",non-deppressive
599, Ayat-ayat Allah ni macam pelampung yang aku berpaut dalam ombak dan badai kemurungan yang hampir menenggelamkan aku,"['ayat', 'ayat', 'allah', 'ini', 'macam', 'pelampung', 'yang', 'aku', 'paut', 'dalam', 'ombak', 'dan', 'badai', 'murung', 'yang', 'hampir', 'tenggelam', 'aku']",medical history
600,"Kesimpulannya, bila kemurungan tu lau ikhtiar dapatkan rawatan perubatan dalam masa yang sama hubungan dengan Allah pun kau cuba improve","['simpul', 'bila', 'murung', 'itu', 'lau', 'ikhtiar', 'dapat', 'rawat', 'ubat', 'dalam', 'masa', 'yang', 'sama', 'hubung', 'deng', 'allah', 'pun', 'kamu', 'cuba', 'tambah', 'baik']",non-deppressive
601, Dan pandangan negatif termasuklah doktor atau kakitangan kesihatan yang tak memahami kau tolak tepi walaupun kau rasa sakit hati dan takde sape paham kau,"['dan', 'pandang', 'negatif', 'masuk', 'doktor', 'atau', 'kakitang', 'kesihat', 'yang', 'tidak', 'paham', 'kamu', 'tolak', 'tepi', 'walaupun', 'kamu', 'rasa', 'sakit', 'hati', 'dan', 'tiada', 'siapa', 'fahami', 'kamu']",non-deppressive
602, Jangan biarkan pengalaman tak best menghalang kau daripada teruskan rawatan,"['jang', 'biar', 'alam', 'tidak', 'baik', 'halang', 'kamu', 'daripada', 'terus', 'rawat']",non-deppressive
603,"Dan start je kau dapat diagnosis, time tu akan jadi lagi susah, aku mula aku amek ubat pun ade yg x kena, nak aplikasikan nasihat doktor daripada psikoterapi pun sakit, kau kena lawan diri kau","['dan', 'mula', 'sahaja', 'kamu', 'dapat', 'diagnosis', 'masa', 'itu', 'akan', 'jadi', 'lagi', 'susah', 'aku', 'mula', 'aku', 'ambil', 'ubat', 'pun', 'ada', 'yang', 'tidak', 'kena', 'nak', 'aplikasi', 'nasihat', 'doktor', 'daripada', 'psikoterapi', 'pun', 'sakit', 'kamu', 'kena', 'la', 'diri', 'kamu']",non-deppressive
604, It does not get easier but eventually it will,"['ia', 'tidak', 'tidak', 'dapat', 'lebih', 'mudah', 'tetapi', 'akhir', 'ia', 'akan']",non-deppressive
605,Keep moving,"['terus', 'moving']",non-deppressive
606, Keep trying,"['terus', 'mencuba']",non-deppressive
607, Teruskan bernafas walau kau rasa tak mau,"['terus', 'nafas', 'walau', 'kamu', 'rasa', 'tidak', 'mahu']",non-deppressive
608, Teruskan bernafas sampai kau betul-betul rasa nak hidup,"['terus', 'nafas', 'sampai', 'kamu', 'betul', 'betul', 'rasa', 'nak', 'hidup']",non-deppressive
609,"Alhamdulillah sekarang aku dah sangat banyak improvement, asbab rawatan doktor aku dan sokongan orang-orang terdekat aku","['alhamdulil', 'sekarang', 'aku', 'dah', 'sangat', 'banyak', 'penambahbai', 'asbab', 'rawat', 'doktor', 'aku', 'dan', 'sokong', 'orang', 'orang', 'dekat', 'aku']",non-deppressive
610, Semoga Allah rahmati mereka dan semoga lebih ramai doktor yang baik macam doktor aku,"['moga', 'allah', 'rahmat', 'mereka', 'dan', 'moga', 'lebih', 'ramai', 'doktor', 'yang', 'baik', 'macam', 'doktor', 'aku']",non-deppressive
611, Kau takkan tahu betapa nikmatnya perasaan nak hidup bila kau pernah lalui fasa taknak hidup,"['kamu', 'tidak', 'akan', 'tahu', 'betapa', 'nikmat', 'asa', 'nak', 'hidup', 'bila', 'kamu', 'pernah', 'lalu', 'fasa', 'tidak', 'nak', 'hidup']",non-deppressive
612,Last aku nak share,"['akhir', 'aku', 'nak', 'bahagi']",non-deppressive
613, Sentiasa amalkan doa ni :اللّهم إني أعوذبك من الهَمِّ و الحزنAda sambungan dia lagi korang carik lah sendiri eh,"['sentiasa', 'amal', 'doa', 'ini', 'angan', 'angan', 'angan', 'angan', 'angan', 'angan', 'angan', 'angan', 'angan', 'angan', 'angan', 'angan', 'anganada', 'sambung', 'dia', 'lagi', 'kamu', 'semua', 'carik', 'sendiri', 'eh']",non-deppressive
614," Hammi tu maksud die anxiety, hazan to sadness aka depression","['hammi', 'itu', 'maksud', 'mati', 'bimbang', 'az', 'kepada', 'sedih', 'aka', 'murung']",non-deppressive
615,P/s : aku pergi klinik kerajaan pada kedua-dua fasa yang berbeza tersebut,"['pergi', 'seperti', 'aku', 'pergi', 'klinik', 'raja', 'pada', 'dua', 'dua', 'fasa', 'yang', 'berbeza', 'sebut']",non-deppressive
616,– FibonacciHantar confession anda di sini -> www,"['angan', 'fibonaccihantar', 'pengi', 'anda', 'di', 'sini', 'w']",non-deppressive
617,iiumc,['iium'],non-deppressive
618,com/submit,"['com', 'muka']",non-deppressive
619,Assalamualaikum dan salam sejahtera kepada pembaca IIUM Confessions dan para admins,"['assalamualaikum', 'dan', 'salam', 'sejahtera', 'kepada', 'baca', 'iium', 'confessions', 'dan', 'para', 'admin']",non-deppressive
620," Terlebih dahulu, saya berterima kasih kepada pihak admins jika coretan ini diterbitkan","['lebih', 'dahulu', 'saya', 'terima', 'kasih', 'kepada', 'pihak', 'admin', 'jika', 'coret', 'ini', 'terbit']",non-deppressive
621," Walaupun tidak diterbitkan, terima kasih kerana sudi membaca","['walaupun', 'tidak', 'terbit', 'terima', 'kasih', 'rana', 'sudi', 'baca']",non-deppressive
622,Saya mulakan dengan pengenalan diri saya,"['saya', 'mula', 'deng', 'kenal', 'diri', 'saya']",non-deppressive
623," Nama saya Tia, anak sulung daripada tiga beradik","['nama', 'saya', 'tia', 'anak', 'sulung', 'daripada', 'tiga', 'adik']",non-deppressive
624," Sebagai anak sulung, saya sedar jika sesuatu berlaku kepada ibu bapa saya, secara automatik tanggungjawab keluarga dipikul oleh saya","['bagai', 'anak', 'sulung', 'saya', 'dar', 'jika', 'sesuat', 'laku', 'kepada', 'ibu', 'bapa', 'saya', 'cara', 'automatik', 'bertanggungjawab', 'keluarga', 'pikul', 'oleh', 'saya']",risk factor
625," Sebenarnya, saya merasakan bahawa saya mengalami kemurungan","['benar', 'saya', 'rasa', 'bahawa', 'saya', 'alami', 'murung']",non-deppressive
626," Ya, saya pasti ramai pembaca akan menyuruh saya untuk berjumpa dengan doktor untuk kepastian","['ya', 'saya', 'pasti', 'ramai', 'baca', 'akan', 'suruh', 'saya', 'untuk', 'jumpa', 'deng', 'doktor', 'untuk', 'kepasti']",non-deppressive
627, Ada beberapa sebab yang menyebabkan saya untuk tidak pergi berjumpa dengan doktor,"['ada', 'beberapa', 'sebab', 'yang', 'sebab', 'saya', 'untuk', 'tidak', 'pergi', 'jumpa', 'deng', 'doktor']",non-deppressive
628,Kisah saya bermula sewaktu saya sekolah rendah,"['kisah', 'saya', 'mula', 'waktu', 'saya', 'seko', 'rendah']",non-deppressive
629," Seorang pelajar yang pintar dan disayangi guru, kehidupan saya dipenuhi dengan momen ceria","['orang', 'ajar', 'yang', 'pintar', 'dan', 'sayang', 'guru', 'hidup', 'saya', 'penuh', 'deng', 'momen', 'ceria']",non-deppressive
630," Namun, semua itu berubah apabila saya mengalami epilepsi atau lebih dikenali sebagai sawan","['namun', 'semua', 'itu', 'rubah', 'apabila', 'saya', 'alami', 'epilsi', 'atau', 'lebih', 'nali', 'bagai', 'sawan']",risk factor
631, Penyakit ini secara tidak langsung telah mengubah kehidupan saya,"['sakit', 'ini', 'cara', 'tidak', 'langsung', 'te', 'ubah', 'hidup', 'saya']",risk factor
632, Penyakit saya dibicara oleh para guru tanpa segan-silu malah ada pelajar mendengarnya,"['sakit', 'saya', 'bicara', 'oleh', 'para', 'guru', 'tanpa', 'seg', 'silu', 'ma', 'ada', 'ajar', 'dengar']",risk factor
633," Saya diejek dengan perkataan “sawan babi”, “wayar putus” dan beberapa perkataan yang sudah saya lupakan","['saya', 'ejek', 'deng', 'kata', 'sawan', 'khinzir', 'wayar', 'putus', 'dan', 'beberapa', 'kata', 'yang', 'sudah', 'saya', 'lupa']",risk factor
634," Sampai satu ketika, saya pernah menangis kerana diejek sebegitu","['sampai', 'satu', 'ketika', 'saya', 'pernah', 'menang', 'rana', 'ejek', 'begitu']",risk factor
635, Faktor ejekan tersebut mendorong saya untuk membuat keputusan memasuki sekolah menengah di mana tiada langsung pelajar sekolah rendah yang sama dengan saya,"['faktor', 'eje', 'sebut', 'dorong', 'saya', 'untuk', 'buat', 'putus', 'masuk', 'seko', 'tengah', 'di', 'mana', 'tiada', 'langsung', 'ajar', 'seko', 'rendah', 'yang', 'sama', 'deng', 'saya']",risk factor
636,"Alam sekolah menengah, saya menyembunyikan penyakit saya dan Alhamdulillah, saya tidak diserang sawan sehingga Tingkatan 3","['alam', 'seko', 'tengah', 'saya', 'sembunyi', 'sakit', 'saya', 'dan', 'alhamdulil', 'saya', 'tidak', 'serang', 'sawan', 'sehingga', 'tingkat', 'tiga']",non-deppressive
637," Ketika itu, ayah saya bertugas di luar negara","['ketika', 'itu', 'ayah', 'saya', 'tugas', 'di', 'luar', 'negara']",non-deppressive
638, Hanya ibu yang mengurus keluarga,"['ha', 'ibu', 'yang', 'urus', 'keluarga']",non-deppressive
639," Sewaktu penyakit ini menyerang, saya melihat betapa lemahnya seorang ibu","['waktu', 'sakit', 'ini', 'serang', 'saya', 'lihat', 'betapa', 'lemah', 'orang', 'ibu']",risk factor
640," Dia yang tak pernah tunjuk penatnya, menangis melihat saya diserang sawan","['dia', 'yang', 'tidak', 'mengaparna', 'tunjuk', 'penat', 'menang', 'lihat', 'saya', 'serang', 'sawan']",risk factor
641, Malah ayah saya turut dihubungi dan diminta pulang dengan kadar segera,"['ma', 'ayah', 'saya', 'turut', 'hubung', 'dan', 'minta', 'pulang', 'deng', 'kadar', 'segera']",risk factor
642," Pada ketika itu, saya tidak merasakan apa-apa","['pada', 'ketika', 'itu', 'saya', 'tidak', 'rasa', 'apa', 'apa']",non-deppressive
643, Tumpuan saya hanya pada PMR,"['tumpu', 'saya', 'ha', 'pada', 'pmr']",non-deppressive
644, Saya lulus dengan cemerlang and juga bersyukur kerana rakan-rakan serta para guru langsung tidak pernah menyebut soal penyakit saya,"['saya', 'lulus', 'deng', 'cemerlang', 'dan', 'juga', 'syukur', 'rana', 'rak', 'rak', 'dan', 'juga', 'para', 'guru', 'langsung', 'tidak', 'pernah', 'sebut', 'soal', 'sakit', 'saya']",non-deppressive
645," Namun begitu, kami sekeluarga terpaksa berpindah atas tuntutan kerja ayah","['namun', 'begitu', 'kami', 'sekeluarga', 'paksa', 'pindah', 'atas', 'tuntut', 'kerja', 'ayah']",risk factor
646,"Di sini, bermula episod kemurungan saya","['di', 'sini', 'mula', 'episod', 'murung', 'saya']",risk factor
647, Saya yang berasal daripada sekolah perempuan sahaja memasuki sekolah di mana pelajarnya bercampur lelaki dan perempuan,"['saya', 'yang', 'asal', 'daripada', 'seko', 'perempu', 'sahaja', 'masuk', 'seko', 'di', 'mana', 'lajur', 'campur', 'lelaki', 'dan', 'perempu']",non-deppressive
648, Membawa nama sekolah perempuan saya pada ketika itu telah menyebabkan saya dipulau tanpa ditanya apa-apa,"['bawa', 'nama', 'seko', 'perempu', 'saya', 'pada', 'ketika', 'itu', 'te', 'sebab', 'saya', 'pulau', 'tanpa', 'dita', 'apa', 'apa']",risk factor
649, Saya hanya berkawan dengan rakan-rakan cina,"['saya', 'ha', 'berka', 'deng', 'rak', 'rak', 'cina']",non-deppressive
650," Pada ketika ini, saya merasakan kehidupan saya sunyi dan saya memberontak secara diam terhadap ibu bapa saya","['pada', 'ketika', 'ini', 'saya', 'rasa', 'hidup', 'saya', 'sunyi', 'dan', 'saya', 'berontak', 'cara', 'diam', 'hadap', 'ibu', 'bapa', 'saya']",symptom
651, Pelajaran saya mulai merosot dan kedatangan saya ke sekolah diselangi dengan ponteng di bawah pengawasan ibu saya,"['ajar', 'saya', 'mulai', 'merosot', 'dan', 'datang', 'saya', 'ke', 'seko', 'lang', 'deng', 'ponteng', 'di', 'bawah', 'awas', 'ibu', 'saya']",symptom
652, Saya menjadi seorang yang lebih gemar bersendirian dan mula mencipta rakan imaginasi,"['saya', 'jadi', 'orang', 'yang', 'lebih', 'gemar', 'bersendiri', 'dan', 'mula', 'cipta', 'rak', 'imaginasi']",symptom
653, Sehingga sekarang ibu bapa saya tidak tahu soal rakan imaginasi saya,"['sehingga', 'sekarang', 'ibu', 'bapa', 'saya', 'tidak', 'tahu', 'soal', 'rak', 'imaginasi', 'saya']",symptom
654, Kejadian pulau itu tidak berlarutan lama,"['jadi', 'pulau', 'itu', 'tidak', 'larut', 'lama']",non-deppressive
655," Setelah saya menjelaskan nama sekolah lama dan berbuat baik, ada yang sudi berkawan dengan saya","['sete', 'saya', 'jelas', 'nama', 'seko', 'lama', 'dan', 'buat', 'baik', 'ada', 'yang', 'sudi', 'berka', 'deng', 'saya']",non-deppressive
656," Namun begitu, saya tidak meletakkan sepenuh kepercayaan terhadap mereka","['namun', 'begitu', 'saya', 'tidak', 'letak', 'sepenuh', 'percaya', 'hadap', 'mereka']",symptom
657," Malah, pada waktu itu saya tidak mempercayai sesiapa kecuali diri saya","['ma', 'pada', 'waktu', 'itu', 'saya', 'tidak', 'percaya', 'siapa', 'kecuali', 'diri', 'saya']",symptom
658,"Tamat persekolahan, saya banyak menghabiskan masa di sosial media","['tamat', 'persekolah', 'saya', 'banyak', 'habis', 'masa', 'di', 'sosial', 'media']",symptom
659, Medium ini menjadi tempat saya meluahkan perasaan malah rakan maya saya banyak membantu saya,"['sederhana', 'ini', 'jadi', 'tempat', 'saya', 'luah', 'asa', 'ma', 'rak', 'maya', 'saya', 'banyak', 'bantu', 'saya']",symptom
660, Saya meneruskan pengajian ke sebuah universiti dan di sana saya mula mempercayai rakan sekelas saya,"['saya', 'terus', 'aji', 'ke', 'buah', 'universiti', 'dan', 'di', 'sana', 'saya', 'mula', 'percaya', 'rak', 'kelas', 'saya']",non-deppressive
661," Ibarat kaca yang telah dicantum berderai semula, begitu juga kepercayaan saya","['ibarat', 'kaca', 'yang', 'te', 'cantum', 'derai', 'semu', 'begitu', 'juga', 'percaya', 'saya']",non-deppressive
662, Saya ditinggalkan oleh rakan sekelas saya malah dipulau secara tidak langsung oleh mereka,"['saya', 'tinggal', 'oleh', 'rak', 'kelas', 'saya', 'ma', 'pulau', 'cara', 'tidak', 'langsung', 'oleh', 'mereka']",risk factor
663," Bahkan, para pensyarah dapat melihat apa yang dilakukan oleh mereka terhadap saya","['bah', 'para', 'syarah', 'dapat', 'lihat', 'apa', 'yang', 'dila', 'oleh', 'mereka', 'hadap', 'saya']",non-deppressive
664, Saya mula bergerak secara solo dan perangai ini saya bawa ke pengajian ijazah,"['saya', 'mula', 'gerak', 'cara', 'solo', 'dan', 'perangai', 'ini', 'saya', 'bawa', 'ke', 'aji', 'ijazah']",non-deppressive
665," Sewaktu pengajian ijazah, saya bertemu dengan rakan-rakan yang sekarang ini saya anggap keluarga kedua saya","['waktu', 'aji', 'ijazah', 'saya', 'temu', 'deng', 'rak', 'rak', 'yang', 'sekarang', 'ini', 'saya', 'anggap', 'keluarga', 'dua', 'saya']",non-deppressive
666,"  Soal percaya, ya saya masih tidak mampu mempercayai manusia sepenuhnya","['soal', 'percaya', 'ya', 'saya', 'masih', 'tidak', 'mampu', 'percaya', 'manusia', 'sepenuh']",non-deppressive
667," Bahkan, diri saya sendiri saya tak mampu untuk percaya","['bah', 'diri', 'saya', 'sendiri', 'saya', 'tidak', 'mampu', 'untuk', 'percaya']",non-deppressive
668, Saya mengalami kemurungan kali ketiga sewaktu tahun ketiga pengajian ijazah,"['saya', 'alami', 'murung', 'kali', 'tiga', 'waktu', 'tahun', 'tiga', 'aji', 'ijazah']",non-deppressive
669, Saya kehilangan seorang rakan baik dan pada waktu yang sama saya mengetahui bahawa orang yang saya menaruh harapan hanyalah mempermainkan saya,"['saya', 'hilang', 'orang', 'rak', 'baik', 'dan', 'pada', 'waktu', 'yang', 'sama', 'saya', 'tahu', 'bahawa', 'orang', 'yang', 'saya', 'menparuh', 'harap', 'ha', 'main', 'saya']",risk factor
670, Kehilangan rakan baik ditambah pula kesibukan membuat tesis telah mejadikan saya terlampau stres,"['hilang', 'rak', 'baik', 'tambah', 'pula', 'sibu', 'buat', 'tesis', 'te', 'mejadi', 'saya', 'lampau', 'tres']",risk factor
671," Apabila stres saya memuncak, saya mula memikirkan tentang kesedihan saya dan tidak melakukan sebarang kerja","['apabila', 'tres', 'saya', 'puncak', 'saya', 'mula', 'memfikir', 'tentang', 'sedih', 'saya', 'dan', 'tidak', 'laku', 'sebarang', 'kerja']",symptom
672, Hanya tidur dan menyelubungi diri saya dengan selimut,"['ha', 'tidur', 'dan', 'selubung', 'diri', 'saya', 'deng', 'selimut']",symptom
673, Air mata gugur berkali-kali,"['udara', 'mata', 'gugur', 'kal', 'kali']",symptom
674, Tiada siapa pun tahu,"['tiada', 'siapa', 'pun', 'tahu']",non-deppressive
675," Malah sehingga sekarang, apabila kemurungan melanda, saya hanya mampu menangis dalam senyap tanpa pengetahuan sesiapa","['ma', 'sehingga', 'sekarang', 'apabila', 'murung', 'landa', 'saya', 'ha', 'mampu', 'menang', 'dalam', 'senyap', 'tanpa', 'tahu', 'siapa']",symptom
676,Saya tidak pasti berapa ramai lagi pembaca yang sedang membaca kisah saya,"['saya', 'tidak', 'pasti', 'berapa', 'ramai', 'lagi', 'baca', 'yang', 'sedang', 'baca', 'kisah', 'saya']",non-deppressive
677, Berbalik kepada soalan mengapa saya tidak berjumpa dengan doktor untuk kepastian,"['balik', 'kepada', 'soal', 'mengapa', 'saya', 'tidak', 'jumpa', 'deng', 'doktor', 'untuk', 'kepasti']",non-deppressive
678, Saya yang mempunyai tahap keyakinan diri yang lemah,"['saya', 'yang', 'punya', 'tahap', 'yakin', 'diri', 'yang', 'lemah']",symptom
679, Ibu saya menyedari hal ini dan sering membezakan saya dengan adik saya,"['ibu', 'saya', 'dari', 'hal', 'ini', 'dan', 'sering', 'membeza', 'saya', 'deng', 'adik', 'saya']",risk factor
680, Hal ini telah mengakibatkan diri saya berada dalam keadaan stres,"['hal', 'ini', 'te', 'akibat', 'diri', 'saya', 'ada', 'dalam', 'ada', 'tres']",symptom
681," Selain itu, saya merupakan seorang yang pendiam dan hanya berbicara jika perlu","['selain', 'itu', 'saya', 'rupa', 'orang', 'yang', 'diam', 'dan', 'ha', 'bicara', 'jika', 'perlu']",non-deppressive
682," Berat mulut, itulah ungkapan ibu saya kepada saya","['berat', 'mulut', 'itu', 'ungkap', 'ibu', 'saya', 'kepada', 'saya']",non-deppressive
683," Ya, saya mampu untuk pergi ke hospital sendiri","['ya', 'saya', 'mampu', 'untuk', 'pergi', 'ke', 'hospital', 'sendiri']",non-deppressive
684," Namun, kehidupan saya sentiasa dibayangi ibu bapa saya","['namun', 'hidup', 'saya', 'sentiasa', 'bayang', 'ibu', 'bapa', 'saya']",risk factor
685, Tidak kah mereka pelik untuk apa saya pergi ke klinik atau hospital sedangkan saya sihat? Malah setiap pergerakan keluar masuk rumah saya pasti ditemani oleh ibu bapa saya,"['tidak', 'mereka', 'pelik', 'untuk', 'apa', 'saya', 'pergi', 'ke', 'klinik', 'atau', 'hospital', 'sedang', 'saya', 'sihat', 'ma', 'tiap', 'pergera', 'keluar', 'masuk', 'rumah', 'saya', 'pasti', 'tani', 'oleh', 'ibu', 'bapa', 'saya']",non-deppressive
686, Memberitahu soal kemurungan kepada ibu bapa? Kepercayaan saya terhadap mereka belum pulih sepenuhnya,"['memberitahu', 'soal', 'murung', 'kepada', 'ibu', 'bapa', 'percaya', 'saya', 'hadap', 'mereka', 'belum', 'pulih', 'sepenuh']",symptom
687, Saya juga masih ingat sesi di hospital di mana ayah saya berpura-pura menghidap sawan sedangkan saya yang sakit,"['saya', 'juga', 'masih', 'ingat', 'sesi', 'di', 'hospital', 'di', 'mana', 'ayah', 'saya', 'pura', 'pura', 'menghidap', 'sawan', 'sedang', 'saya', 'yang', 'sakit']",non-deppressive
688," Wajarkah saya untuk membebani hati serta kepala mereka dengan kemurungan saya?Jika dahulu, saya hanya menangis","['wajar', 'saya', 'untuk', 'membeb', 'hati', 'dan', 'juga', 'kepala', 'mereka', 'deng', 'murung', 'saya', 'jika', 'dahulu', 'saya', 'ha', 'menang']",risk factor
689," Tapi kini, saya membayangkan pisau dan saya pasti anda memahami apa yang saya bayangkan","['tetapi', 'kini', 'saya', 'bayang', 'pisau', 'dan', 'saya', 'pasti', 'anda', 'paham', 'apa', 'yang', 'saya', 'bayang']",symptom
690, Saya sedar kemurungan saya semakin teruk dan saya perlu bantuan segera,"['saya', 'dar', 'murung', 'saya', 'makin', 'teruk', 'dan', 'saya', 'perlu', 'bantu', 'segera']",non-deppressive
691, Saya berharap agar saya cepat mendapatkan pekerjaan dan keluar daripada rumah,"['saya', 'harap', 'agar', 'saya', 'cepat', 'dapat', 'pekerja', 'dan', 'keluar', 'daripada', 'rumah']",non-deppressive
692," Dengan cara ini, saya dapat pergi mendapatkan bantuan tanpa pengetahuan ibu bapa","['deng', 'cara', 'ini', 'saya', 'dapat', 'pergi', 'dapat', 'bantu', 'tanpa', 'tahu', 'ibu', 'bapa']",non-deppressive
693,Saya berharap sangat para pembaca dapat membantu saya secara tidak langsung,"['saya', 'harap', 'sangat', 'para', 'baca', 'dapat', 'bantu', 'saya', 'cara', 'tidak', 'langsung']",non-deppressive
694, Berhati-hati dengan komen anda kerana bisa kata-kata boleh menjatuhkan seseorang,"['hati', 'hati', 'deng', 'komen', 'anda', 'rana', 'bisa', 'kata', 'kata', 'boleh', 'jatuh', 'orang']",non-deppressive
695,– TiaHantar confession anda di sini -> www,"['angan', 'tiahantar', 'pengi', 'anda', 'di', 'sini', 'w']",non-deppressive
696,iiumc,['iium'],non-deppressive
697,com/submit,"['com', 'muka']",non-deppressive
698,Kemurungan dan Rasa Cemas yang tak dapat Di kawal,"['murung', 'dan', 'rasa', 'cemas', 'yang', 'tidak', 'dapat', 'di', 'kawal']",non-deppressive
699, Pengakuan diri sendiri harap dapat membantu sesiapa yg pernah dan tengah alami di luar sana,"['pengi', 'diri', 'sendiri', 'harap', 'dapat', 'bantu', 'siapa', 'yang', 'pernah', 'dan', 'tengah', 'alami', 'di', 'luar', 'sana']",non-deppressive
700, Ini berlaku setelah aku bertukar tempat kerja yg nyata pada awalnya dapat di urus dengan baik tetapi setelah 3 bulan di tukar ke assignment yang lebih susah,"['ini', 'laku', 'sete', 'aku', 'tukar', 'tempat', 'kerja', 'yang', 'nyata', 'pada', 'awal', 'dapat', 'di', 'urus', 'deng', 'baik', 'tetapi', 'sete', 'tiga', 'bul', 'di', 'tukar', 'ke', 'assignment', 'yang', 'lebih', 'susah']",risk factor
701, Assignment baru ini telah menyebabkan ramai rakan rakan kerja sejawatan dan rakan rakan lain telah ambil keputusan untuk berhenti dan menukar kerja ke jabatan lain ataupun ke syarikat lain,"['assignment', 'baru', 'ini', 'te', 'sebab', 'ramai', 'rak', 'rak', 'kerja', 'jawat', 'dan', 'rak', 'rak', 'lain', 'te', 'ambil', 'putus', 'untuk', 'henti', 'dan', 'tukar', 'kerja', 'ke', 'jabat', 'lain', 'atau', 'ke', 'syarikat', 'lain']",risk factor
702, benda nie berlaku di syarikat international-kilang electronics,"['benda', 'ini', 'laku', 'di', 'syarikat', 'antarabangsa', 'kilang', 'elektronik']",non-deppressive
703, Bagi aku ,"['bagi', 'aku']",non-deppressive
704, aku suka dengan challenge dan aku sahut cabaran dari boss aku ,"['aku', 'suka', 'deng', 'cabar', 'dan', 'aku', 'sahut', 'cabar', 'dari', 'bos', 'aku']",non-deppressive
705, yg mana boss aku nie aku katergorykan old style dan lembab dalam buat keputusan ,"['yang', 'mana', 'bos', 'aku', 'ini', 'aku', 'kategory', 'old', 'gaya', 'dan', 'lembab', 'dalam', 'buat', 'putus']",non-deppressive
706, bayankan satu isu meeting untuk finalize boleh ambil masa sampai 4 jam ,"['bayan', 'satu', 'isu', 'mesyuarat', 'untuk', 'muktamad', 'boleh', 'ambil', 'masa', 'sampai', 'empat', 'jam']",non-deppressive
707, kadang kadang stress bukan sebab kerja tapi sebab terlampau banyak menunggu keputusan dari boss,"['kadang', 'kadang', 'tres', 'bu', 'sebab', 'kerja', 'tetapi', 'sebab', 'lampau', 'banyak', 'tunggu', 'putus', 'dari', 'bos']",risk factor
708, diri terkesan apabila kesibukkan melampau sehingga banyak kerja yang tertangguh di sertai dengan di herdik dan di marah oleh orang atasan di sebabkan KPI tidak seperti yang di hendaki,"['diri', 'terkes', 'apabila', 'sibu', 'lampau', 'sehingga', 'banyak', 'kerja', 'yang', 'tangguh', 'di', 'serta', 'deng', 'di', 'herdik', 'dan', 'di', 'marah', 'oleh', 'orang', 'atas', 'di', 'sebab', 'kpi', 'tidak', 'seperti', 'yang', 'di', 'hendak']",risk factor
709, Badan akan rasa panas sejuk tetapi bukan demam,"['badan', 'akan', 'rasa', 'panas', 'sejuk', 'tetapi', 'bu', 'demam']",risk factor
710, banyak masalah yang di fikirkan dan setiap masalah kita nak selesaikan dengan yang terbaik,"['banyak', 'masa', 'yang', 'di', 'fikir', 'dan', 'tiap', 'masa', 'k', 'nak', 'selesai', 'deng', 'yang', 'baik']",non-deppressive
