,raw text,token text,category
975, Kini saya ingin keluar daripada segala kemurungan dan ingin menjadi seorang isteri solehah yg sentiasa memaafkan dan memberi pedoman,"['kini', 'saya', 'ingin', 'keluar', 'daripada', 'segala', 'murung', 'dan', 'ingin', 'jadi', 'orang', 'isteri', 'solehah', 'yang', 'sentiasa', 'memuefa', 'dan', 'beri', 'pedom']",non-deppressive
976, Saya tahu ramai yang mengalami situasi ini tapi,"['saya', 'tahu', 'ramai', 'yang', 'alami', 'situasi', 'ini', 'tetapi']",non-deppressive
977,tak terungkap dengan luahan kata kata apa yang dilaluinya,"['tidak', 'terungkap', 'deng', 'luah', 'kata', 'kata', 'apa', 'yang', 'lalu']",non-deppressive
978,Terima kasih kepada pembaca,"['terima', 'kasih', 'kepada', 'baca']",non-deppressive
979, Saya mengharapkan secebis doa daripada kalian supaya hati ini kembali kuat dan teguh apabila diuji,"['saya', 'harap', 'cebis', 'doa', 'daripada', 'kalian', 'supaya', 'hati', 'ini', 'kembali', 'kuat', 'dan', 'teguh', 'apabila', 'uji']",non-deppressive
980, Sokongan dan pemahaman amat diperlukan pada saat ini,"['sokong', 'dan', 'paham', 'amat', 'diperlu', 'pada', 'saat', 'ini']",non-deppressive
981,Semoga kita menjadi umat yg kuat diakhir zaman ini,"['moga', 'k', 'jadi', 'umat', 'yang', 'kuat', 'akhir', 'zaman', 'ini']",non-deppressive
982,– IntanHantar confession anda di sini -> www,"['angan', 'intanhantar', 'pengi', 'anda', 'di', 'sini', 'w']",non-deppressive
983,iiumc,['iium'],non-deppressive
984,com/submit,"['com', 'muka']",non-deppressive
985,"Assalamualaikum, terima kasih admin kerana approve hantaran ini","['assalamualaikum', 'terima', 'kasih', 'admin', 'rana', 'approve', 'hantar', 'ini']",non-deppressive
986,Semalam terkejut sangat sebab jumpa post yang seakan-akan melabel pesakit depression sebagai kufur,"['malam', 'kejut', 'sangat', 'sebab', 'jumpa', 'jawat', 'yang', 'sea', 'akan', 'label', 'sakit', 'murung', 'bagai', 'kufur']",non-deppressive
987," Bukan itu sahaja, beliau malah menggunakan ayat Quran untuk justify pandangan tersebut","['bu', 'itu', 'sahaja', 'beliau', 'ma', 'guna', 'ayat', 'qur', 'untuk', 'justify', 'pandang', 'sebut']",non-deppressive
988,Siapa kita untuk menghukum orang lain? Kita bukanlah antara golongan yang dijamin syurga,"['siapa', 'k', 'untuk', 'hukum', 'orang', 'lain', 'k', 'bu', 'antara', 'golong', 'yang', 'jamin', 'syurga']",non-deppressive
989, Tidak adil untuk pukul rata semua pesakit depression tu kufur,"['tidak', 'adil', 'untuk', 'pukul', 'rata', 'semua', 'sakit', 'murung', 'itu', 'kufur']",non-deppressive
990, Malah islam tidak mengajar kita untuk menhukum orang lain,"['ma', 'islam', 'tidak', 'ajar', 'k', 'untuk', 'menhukum', 'orang', 'lain']",non-deppressive
991,Stigma sebegini sangat bahaya,"['stigma', 'begini', 'sangat', 'bahaya']",non-deppressive
992," Boleh menyebabkan pesakit kemurungan tidak mahu berkongsi rasa, malah ada yang mungkin tidak mendapatkan rawatan kerana risau dihukum sebagai “kufur”, “jauh dari Tuhan”, “lemah iman” dan sebagainya","['boleh', 'sebab', 'sakit', 'murung', 'tidak', 'mahu', 'kongsi', 'rasa', 'ma', 'ada', 'yang', 'mungkin', 'tidak', 'dapat', 'rawat', 'rana', 'risau', 'hukum', 'bagai', 'kufur', 'jauh', 'dari', 'tuh', 'lemah', 'im', 'dan', 'bagai']",non-deppressive
993,Sedangkan depression tu merupakan satu penyakit dan boleh dirawat,"['sedang', 'murung', 'itu', 'rupa', 'satu', 'sakit', 'dan', 'boleh', 'rawat']",non-deppressive
994," Seperti penyakit-penyakit lain, depression juga disebabkan beberapa faktor seperti hormon, genetik, dan persekitaran","['seperti', 'sakit', 'sakit', 'lain', 'murung', 'juga', 'sebab', 'beberapa', 'faktor', 'seperti', 'hormon', 'genetik', 'dan', 'sekitar']",non-deppressive
995, Barah bukan disebabkan kufur kan? Haa macam tu jugak la depression,"['barah', 'bu', 'sebab', 'kufur', 'kan', 'ha', 'macam', 'itu', 'juga', 'murung']",non-deppressive
996,"Mungkin lepas baca luahan ni, ada yang akan kata “betullah kalau dekat dengan Allah takkan depress”","['mungkin', 'lepas', 'baca', 'luah', 'ini', 'ada', 'yang', 'akan', 'kata', 'betul', 'kalau', 'dekat', 'deng', 'allah', 'tidak', 'akan', 'depress']",non-deppressive
997, Tapi sebelum tu saya nak kata yang pandangan itu sangat salah,"['tetapi', 'belum', 'itu', 'saya', 'nak', 'kata', 'yang', 'pandang', 'itu', 'sangat', 'sa']",non-deppressive
998, Dan merupakan stigma yang sangat berat,"['dan', 'rupa', 'stigma', 'yang', 'sangat', 'berat']",non-deppressive
999,"Haah, betul dengan mendekatkan diri dengan Allah, kita boleh tenang dan hilang tekanan, tetapi perlu ingat, depression ini penyakit","['haah', 'betul', 'deng', 'dekat', 'diri', 'deng', 'allah', 'k', 'boleh', 'tenang', 'dan', 'hilang', 'tekan', 'tetapi', 'perlu', 'ingat', 'murung', 'ini', 'sakit']",non-deppressive
1000," Dekatkan diri dengan Allah tu perlu, tetapi perlu juga mendapatkan rawatan pakar","['dekat', 'diri', 'deng', 'allah', 'itu', 'perlu', 'tetapi', 'perlu', 'juga', 'dapat', 'rawat', 'pakar']",non-deppressive
1001," Antara rawatan yang akan diberi adalah ubatan, terapi atau kedua-dua sekali bergantung pada keadaan pesakit","['antara', 'rawat', 'yang', 'akan', 'beri', 'ada', 'ubat', 'terapi', 'atau', 'dua', 'dua', 'sekali', 'gantung', 'pada', 'ada', 'sakit']",non-deppressive
1002,"Tapi macam mana orang yang sedang depress nak mendapatkan rawatan jika sekali diluahkan perasaan, terus dicop lemah iman dan sebagainya","['tetapi', 'macam', 'mana', 'orang', 'yang', 'sedang', 'depress', 'nak', 'dapat', 'rawat', 'jika', 'sekali', 'luah', 'asa', 'terus', 'cop', 'lemah', 'im', 'dan', 'bagai']",non-deppressive
1003, Sedangkan kita dituntut untuk merujuk pakar dan berusaha dalam bertawakal,"['sedang', 'k', 'tuntut', 'untuk', 'rujuk', 'pakar', 'dan', 'berusaha', 'dalam', 'tawakal']",non-deppressive
1004,  Stigma sebegini la juga yang menjauhkan orang-orang dari orang alim,"['stigma', 'begini', 'juga', 'yang', 'jauh', 'orang', 'orang', 'dari', 'orang', 'alim']",non-deppressive
1005," Bukankah ini merugikan Islam tu sendiri? Pesakit depression perlukan harapan dan bantuan, bukan kecaman","['bukan', 'ini', 'merugi', 'islam', 'itu', 'sendiri', 'sakit', 'murung', 'perlu', 'harap', 'dan', 'bantu', 'bu', 'kecam']",non-deppressive
1006,"Apa kesan stigma ini?Seperti yang dinyataan diatas, dan kesannya bukan sekadar menyebabkan pesakit tidak mendapatkan bantuan, malah kalau keadaan makin teruk boleh menyebabkan pesakit bunuh diri (nauzubillah)","['apa', 'kes', 'stigma', 'ini', 'seperti', 'yang', 'nyata', 'atas', 'dan', 'kesan', 'bu', 'sekadar', 'sebab', 'sakit', 'tidak', 'dapat', 'bantu', 'ma', 'kalau', 'ada', 'makin', 'teruk', 'boleh', 'sebab', 'sakit', 'bunuh', 'diri', 'nauzubil']",non-deppressive
1007,"Jika pandangan-pandangan yang melabel pesakit depression ni tersebar, dan pesakit triggered, boleh membuatkan pesakit self-blame, adakah kita akan bertanggungjawab? Self-blame, rasa diri tidak berguna, rasa diri tiada harapan juga boleh mengakibatkan pesakit bunuh diri","['jika', 'pandang', 'pandang', 'yang', 'label', 'sakit', 'murung', 'ini', 'sebar', 'dan', 'sakit', 'cetus', 'boleh', 'buat', 'sakit', 'diri', 'sendiri', 'salah', 'ada', 'k', 'akan', 'bertanggungjawab', 'diri', 'sendiri', 'salah', 'rasa', 'diri', 'tidak', 'guna', 'rasa', 'diri', 'tiada', 'harap', 'juga', 'boleh', 'akibat', 'sakit', 'bunuh', 'diri']",non-deppressive
1008,Penyakit depression ni semakin hari semakin merunsingkan,"['sakit', 'murung', 'ini', 'makin', 'hari', 'makin', 'merunsing']",non-deppressive
1009," Selain rawatan doktor psikiatri atau psikologis, sokongan daripada individu sekeliling sangat lah penting","['selain', 'rawat', 'doktor', 'psikiatri', 'atau', 'psikologi', 'sokong', 'daripada', 'individu', 'keliling', 'sangat', 'penting']",non-deppressive
1010, Antara gejala depression adalah merasa diri tidak berguna,"['antara', 'gejala', 'murung', 'ada', 'rasa', 'diri', 'tidak', 'guna']",symptom
1011,"Jadi kita sebagai anggota masyarakat perlu memberi harapan yang mereka sangat diperlukan, dan diri mereka bernilai","['jadi', 'k', 'bagai', 'anggota', 'masyarakat', 'perlu', 'beri', 'harap', 'yang', 'mereka', 'sangat', 'diperlu', 'dan', 'diri', 'mereka', 'nila']",non-deppressive
1012, Teruskan berdoa semoga kita tidak mendapat depression,"['terus', 'doa', 'moga', 'k', 'tidak', 'dapat', 'murung']",non-deppressive
1013, Dan dalam masa yang sama mendoakan sahabat kita yang sedang bertarung dengan depression dan lain-lain penyakit mental,"['dan', 'dalam', 'masa', 'yang', 'sama', 'mendoa', 'sahabat', 'k', 'yang', 'sedang', 'tarung', 'deng', 'murung', 'dan', 'lain', 'lain', 'sakit', 'mental']",non-deppressive
1014,– Zinnirah (Bukan nama sebenar)Hantar confession anda di sini -> https://iiumc,"['angan', 'zinnirah', 'bu', 'nama', 'benar', 'hantar', 'pengi', 'anda', 'di', 'sini', 'htps', 'iium']",non-deppressive
1015,com/submit,"['com', 'muka']",non-deppressive
1016,Hai assalamualaikum nama mia ( bukan nama sebenar) 15 tahun,"['hai', 'assalamualaikum', 'nama', 'mia', 'bu', 'nama', 'benar', 'lima', 'belas', 'tahun']",non-deppressive
1017, saya ada satu perasaan yang saya sendiri tak tahu itu apa,"['saya', 'ada', 'satu', 'asa', 'yang', 'saya', 'sendiri', 'tidak', 'tahu', 'itu', 'apa']",non-deppressive
1018, Then saya ade research membawa kepada di bawah ini,"['kemudi', 'saya', 'ada', 'lidi', 'bawa', 'kepada', 'di', 'bawah', 'ini']",non-deppressive
1019,Tanda-tanda penyakit kemurungan1,"['tanda', 'tanda', 'sakit', 'murung']",non-deppressive
1020, Perasaan murung atau sering marah-marah hampir sepanjang hari dan hampir setiap hari dalam tempoh dua minggu,"['asa', 'murung', 'atau', 'sering', 'marah', 'marah', 'hampir', 'panjang', 'hari', 'dan', 'hampir', 'tiap', 'hari', 'dalam', 'tempoh', 'dua', 'minggu']",symptom
1021, Perasaan ini dilaporkan oleh pesakit secara subjektif seperti perasaan rendah diri ataupun daripada pengamatan orang luar contohnya selalu menangis,"['asa', 'ini', 'lapor', 'oleh', 'sakit', 'cara', 'subjektif', 'seperti', 'asa', 'rendah', 'diri', 'atau', 'daripada', 'amat', 'orang', 'luar', 'contoh', 'selalu', 'menang']",symptom
1022, ( ok ini memang selalu cth kalau hari tu kena marah or ada orang sumpah seranah even gurau je pon saya boleh dapat perasaan diri rasa ‘xguna’ or benci dekat diri sendiri,"['okey', 'ini', 'memang', 'selalu', 'cth', 'kalau', 'hari', 'itu', 'kena', 'marah', 'atau', 'ada', 'orang', 'sumah', 'seranah', 'walaupun', 'gurau', 'sahaja', 'pun', 'saya', 'boleh', 'dapat', 'asa', 'diri', 'rasa', 'tidak', 'guna', 'atau', 'benci', 'dekat', 'diri', 'sendiri']",symptom
1023, and macam ada orang bercakap dalam kepala ‘ ko ni tak guan mia benda macam tu pon tak boleh buat ke?’ atau ‘ ko ni tak layak hidup la mia’ atau ‘ semua ni salah ko la mia’ kata- kata tu berlegar dalam kepala walaupun salah yang saya buat alahai sangat sikit,"['dan', 'macam', 'ada', 'orang', 'cakap', 'dalam', 'kepala', 'kamu', 'ini', 'tidak', 'guan', 'mia', 'benda', 'macam', 'itu', 'pun', 'tidak', 'boleh', 'buat', 'ke', 'atau', 'kamu', 'ini', 'tidak', 'layak', 'hidup', 'mia', 'atau', 'semua', 'ini', 'sa', 'kamu', 'mia', 'kata', 'kata', 'itu', 'legar', 'dalam', 'kepala', 'walaupun', 'sa', 'yang', 'saya', 'buat', 'alahai', 'sangat', 'sikit']",symptom
1024, Lagi- lagi bila orang salahkan saya depan – depan secara gurauan dia punya feel tu macam dah tak nak buat ape dah,"['lagi', 'lagi', 'bila', 'orang', 'salah', 'saya', 'dep', 'angan', 'dep', 'cara', 'gurau', 'dia', 'pu', 'rasa', 'itu', 'macam', 'dah', 'tidak', 'mahu', 'buat', 'apa', 'dah']",risk factor
1025, Lebih tepat lagi rasa macam tak nak hidup bila ade orang salah kan kita la,"['lebih', 'tepat', 'lagi', 'rasa', 'macam', 'tidak', 'mahu', 'hidup', 'bila', 'ada', 'orang', 'sa', 'kan', 'k']",symptom
1026,(nampak remeh kan sorry tak reti nak luahkan macam mana harap faham)2,"['tampak', 'remeh', 'kan', 'maaf', 'tidak', 'reti', 'nak', 'luah', 'macam', 'mana', 'harap', 'faham', 'dua']",non-deppressive
1027, Tidak bersemangat atau tidak berminat melakukan aktiviti sosial yang biasa dilakukan hampir setiap hari,"['tidak', 'semangat', 'atau', 'tidak', 'minat', 'laku', 'aktiviti', 'sosial', 'yang', 'biasa', 'dila', 'hampir', 'tiap', 'hari']",symptom
1028, Contohnya tidak berminat untuk bersukan lagi atau berjumpa dengan sanak-saudara,"['contoh', 'tidak', 'minat', 'untuk', 'bersu', 'lagi', 'atau', 'jumpa', 'deng', 'sanak', 'saudara']",symptom
1029, sangat-sangatlah iye,"['sangat', 'sangat', 'siya']",non-deppressive
1030,3,['tiga'],non-deppressive
1031, Berat badan merosot (~5%) daripada asal dalam waktu yang singkat atau kurang selera makan,"['berat', 'badan', 'merosot', 'daripada', 'asal', 'dalam', 'waktu', 'yang', 'singkat', 'atau', 'kurang', 'selera', 'ma']",symptom
1032, Yang ni tak kot sebab aq ni jenis banyak memikir bila penat memikir aq makan,"['yang', 'ini', 'tidak', 'mungkin', 'sebab', 'aku', 'ini', 'jenis', 'banyak', 'pikir', 'bila', 'penat', 'pikir', 'aku', 'ma']",symptom
1033,4,['empat'],non-deppressive
1034," Corak tidur berubah, sama ada kurang tidur (insomnia) atau terlebih tidur (hypersomnia)","['corak', 'tidur', 'rubah', 'sama', 'ada', 'kurang', 'tidur', 'insomnia', 'atau', 'lebih', 'tidur', 'hypersomnia']",symptom
1035,Yang ni sekarang ya,"['yang', 'ini', 'sekarang', 'ya']",non-deppressive
1036," Tak tahu kenapa aq dari dulu lagi kalau buat ujian yg stress, depression, anxiety","['tidak', 'tahu', 'kenapa', 'aku', 'dari', 'dahulu', 'lagi', 'kalau', 'buat', 'uji', 'yang', 'stres', 'murung', 'bimbang']",non-deppressive
1037, Depression dengan anxiety tahap max nun,"['murung', 'deng', 'bimbang', 'tahap', 'max', 'biara']",non-deppressive
1038, kuat tidoq waktu tu la ni ja tiba-tiba dia berubah,"['kuat', 'tido', 'waktu', 'itu', 'ini', 'sahaja', 'tiba', 'tiba', 'dia', 'rubah']",symptom
1039,5,['lima'],non-deppressive
1040," Perubahan dalam melakukan aktiviti seharian, sama ada terlebih aktif atau kurang aktif","['ubah', 'dalam', 'laku', 'aktiviti', 'hari', 'sama', 'ada', 'lebih', 'aktif', 'atau', 'kurang', 'aktif']",symptom
1041, yup ni ye ( kadang – kadang benci dengan diri sendiri sebab ni)6,"['ya', 'ini', 'ya', 'kadang', 'angan', 'kadang', 'benci', 'deng', 'diri', 'sendiri', 'sebab', 'ini', 'enam']",symptom
1042, Selalu letih dan kurang tenaga dalam melakukan aktiviti harian,"['selalu', 'letih', 'dan', 'kurang', 'tenaga', 'dalam', 'laku', 'aktiviti', 'hari']",symptom
1043, even sabtu ahad cuti pon rasa tak larat sangat nak buat keje,"['walaupun', 'sabtu', 'ahad', 'cuti', 'pun', 'rasa', 'tidak', 'larat', 'sangat', 'nak', 'buat', 'kerja']",symptom
1044, Rasa letih dia macam orang kemas rumah dari A-Z ,"['rasa', 'letih', 'dia', 'macam', 'orang', 'kemas', 'rumah', 'dari', 'a', 'z']",symptom
1045,7,['tujuh'],non-deppressive
1046, Perasaan bersalah yang tidak setimpal dengan sesuatu kesalahan perbuatan atau merasakan diri tidak berguna ( yang ni sangat -sangat accurate 10/10,"['asa', 'bersa', 'yang', 'tidak', 'timpal', 'deng', 'sesuat', 'sala', 'buat', 'atau', 'rasa', 'diri', 'tidak', 'guna', 'yang', 'ini', 'sangat', 'sangat', 'tepat', 'puluh', 'per', 'puluh']",symptom
1047, suka sangat salahkan diri sendiri sebab tu saya lebih suka berdiam diri kalau jadi apa-apa saya tak kena mengenalah)  8,"['suka', 'sangat', 'salah', 'diri', 'sendiri', 'sebab', 'itu', 'saya', 'lebih', 'suka', 'diam', 'diri', 'kalau', 'jadi', 'apa', 'apa', 'saya', 'tidak', 'kena', 'kena', 'lap']",symptom
1048, Tidak mampu memberikan konsentrasi atau berfikir secara rasional,"['tidak', 'mampu', 'beri', 'konsentrasi', 'atau', 'pikir', 'cara', 'rasional']",symptom
1049, Pesakit juga merasakan susah untuk membuat keputusan dalam kehidupan hariannya,"['sakit', 'juga', 'rasa', 'susah', 'untuk', 'buat', 'putus', 'dalam', 'hidup', 'hari']",symptom
1050,yup9,"['ya', 'ya', 'ya', 'ya', 'ya', 'ya', 'ya', 'ya', 'ya']",non-deppressive
1051," Berfikir tentang keinginan untuk mati atau bunuh diri dengan kerap, atau mempunyai pelan masa hadapan untuk membunuh diri","['pikir', 'tentang', 'ingin', 'untuk', 'mati', 'atau', 'bunuh', 'diri', 'deng', 'kerap', 'atau', 'punya', 'pel', 'masa', 'hadap', 'untuk', 'bunuh', 'diri']",symptom
1052,Tidak ni je tak mungkin sebab saya agama islam saya rasa selagi solat tak tinggal saya ok je,"['tidak', 'ini', 'sahaja', 'tidak', 'mungkin', 'sebab', 'saya', 'agama', 'islam', 'saya', 'rasa', 'selagi', 'solat', 'tidak', 'tinggal', 'saya', 'okey', 'sahaja']",non-deppressive
1053," cuma bila perasaan tu datang susahApa yang saya nak cakap, tiap-tiap hari saya akan pikir ‘hidup aq esok macam mana?’ ‘malasnya nak hidup’ ‘ tak bergunanya aq’ ‘ susahnya tu susahnya ni’ Lagi satu rasa benci dekat diri sendiri tu sangat2 kuat tiap- tiap hari","['cuma', 'bila', 'asa', 'itu', 'datang', 'susahapa', 'yang', 'saya', 'nak', 'cakap', 'tiap', 'tiap', 'hari', 'saya', 'akan', 'fikir', 'hidup', 'aku', 'esok', 'macam', 'mana', 'malas', 'nak', 'hidup', 'tidak', 'guna', 'aku', 'susah', 'itu', 'susah', 'ini', 'lagi', 'satu', 'rasa', 'benci', 'dekat', 'diri', 'sendiri', 'itu', 'sangat', 'sangat', 'kuat', 'tiap', 'tiap', 'hari']",symptom
1054, saya ni spesies kalau bnda tu pengalaman mennyakitkan hati jiwa dan raga otak saya cepat je lupa,"['saya', 'ini', 'spesies', 'kalau', 'bunda', 'itu', 'alam', 'takit', 'hati', 'jiwa', 'dan', 'raga', 'otak', 'saya', 'cepat', 'sahaja', 'lupa']",symptom
1055, sesetengah la,['tengah'],non-deppressive
1056, so tak pasti apa sebab nak benci diri sendiri tu,"['jadi', 'tidak', 'pasti', 'apa', 'sebab', 'nak', 'benci', 'diri', 'sendiri', 'itu']",symptom
1057,Ha lagi satu kadang tu tanpa sebab tiba-tiba nak nangis,"['ha', 'lagi', 'satu', 'kadang', 'itu', 'tanpa', 'sebab', 'tiba', 'tiba', 'nak', 'menang']",symptom
1058,hmmm tu je lah kot ciri-ciri yang aq hadap setakat ni,"['hama', 'itu', 'sahaja', 'mungkin', 'ciri', 'ciri', 'yang', 'aku', 'hadap', 'setakat', 'ini']",non-deppressive
1059, aq takut sebab orang cakap depression ni jangan main -main,"['aku', 'takut', 'sebab', 'orang', 'cakap', 'murung', 'ini', 'jang', 'utama', 'utama']",non-deppressive
1060,"Justeru, jika anda merasakan anda atau orang terdekat anda mempunyai gejala- gejala yang disebutkan di atas dalam tempoh waktu yang sudah lama, adalah lebih baik anda mendapatkan pertolongan daripada doktor anda atau hubungi mereka yang boleh memberikan pertolongan seperti di bawah","['justru', 'jika', 'anda', 'rasa', 'anda', 'atau', 'orang', 'dekat', 'anda', 'punya', 'gejala', 'gejala', 'yang', 'sebut', 'di', 'atas', 'dalam', 'tempoh', 'waktu', 'yang', 'sudah', 'lama', 'ada', 'lebih', 'baik', 'anda', 'dapat', 'tolong', 'daripada', 'doktor', 'anda', 'atau', 'hubung', 'mereka', 'yang', 'boleh', 'beri', 'tolong', 'seperti', 'di', 'bawah']",non-deppressive
1061,no,['tidak'],non-deppressive
1062,1 dan 2 dan 7 sangat lah diri saya,"['satu', 'dan', 'dua', 'dan', 'tujuh', 'sangat', 'diri', 'saya']",non-deppressive
1063," persoalannya, adakah saya depression?p/s: saya agak2 mesti ramai cakap saya acah depression","['soal', 'ada', 'saya', 'murung', 'pergi', 's', 'saya', 'agak', 'agak', 'mesti', 'ramai', 'cakap', 'saya', 'acah', 'murung']",non-deppressive
1064, saya cuma nak tau saya kategori mana je harap dapat membantu saya,"['saya', 'cuma', 'nak', 'tahu', 'saya', 'kategori', 'mana', 'sahaja', 'harap', 'dapat', 'bantu', 'saya']",non-deppressive
1065, saya tak de tempat nak luah,"['saya', 'tidak', 'ada', 'tempat', 'nak', 'luah']",non-deppressive
1066, mereka tak faham sebab saya tak reti bercerita,"['mereka', 'tidak', 'faham', 'sebab', 'saya', 'tidak', 'reti', 'bercer']",non-deppressive
1067, kalau rasa merepek maafla saya tak reti bercerita,"['kalau', 'rasa', 'repek', 'maaf', 'saya', 'tidak', 'reti', 'bercer']",non-deppressive
1068,(lagi satu thanks admin kalau publish) Harap dapat komen yang membantu,"['lagi', 'satu', 'thanks', 'admin', 'kalau', 'terbit', 'harap', 'dapat', 'komen', 'yang', 'bantu']",non-deppressive
1069,Terima kasih semua,"['terima', 'kasih', 'semua']",non-deppressive
1070,– miaHantar confession anda di sini -> www,"['angan', 'miahantar', 'pengi', 'anda', 'di', 'sini', 'w']",non-deppressive
1071,iiumc,['iium'],non-deppressive
1072,com/submit,"['com', 'muka']",non-deppressive
1073,"""Tak tau macam mana nak cakap","['tidak', 'tahu', 'macam', 'mana', 'nak', 'cakap']",non-deppressive
1074, I was diagnosed with major depression disorder,"['saya', 'ada', 'diagnosed', 'deng', 'utama', 'murung', 'ganggu']",non-deppressive
1075, Ni bukan la kali pertama aku berjumpa dengan Dr untuk treat depression aku dan bukan la kali pertama aku try untuk suicide,"['ini', 'bu', 'kali', 'pertama', 'aku', 'jumpa', 'deng', 'doktor', 'untuk', 'rawat', 'murung', 'aku', 'dan', 'bu', 'kali', 'pertama', 'aku', 'cuba', 'untuk', 'bunuh', 'diri']",symptom
1076," Dulu, pernah pergi treatment tapi aku stop","['dahulu', 'pernah', 'pergi', 'rawat', 'tetapi', 'aku', 'henti']",medical history
1077, And depression still datang sebab aku tak recover betul2 lagi,"['dan', 'murung', 'masih', 'ada', 'datang', 'sebab', 'aku', 'tidak', 'pulih', 'betul', 'betul', 'lagi']",medical history
1078, This year aku pergi dapatkan bantuan lagi daripada pakar sebab aku tak tahan,"['this', 'tahun', 'aku', 'pergi', 'dapat', 'bantu', 'lagi', 'daripada', 'pakar', 'sebab', 'aku', 'tidak', 'tah']",medical history
1079,"  Aku try cederakan diri aku, having suicidal thoughts, tak boleh focus buat kerja, asyik amik MC sakit","['aku', 'cuba', 'cedera', 'diri', 'aku', 'having', 'bunuh', 'diri', 'thoughts', 'tidak', 'boleh', 'tumpu', 'buat', 'kerja', 'asyik', 'ambil', 'mc', 'sakit']",symptom
1080, Kekadang aku ada terfikir nak luahkan kat kawan aku,"['kadang', 'kadang', 'aku', 'ada', 'terfikir', 'nak', 'luah', 'dekat', 'ka', 'aku']",non-deppressive
1081," Aku bagitau aku depressed, sedih","['aku', 'begitu', 'aku', 'terte', 'sedih']",symptom
1082,"  Tapi response dia """"try to think positive"""" , """" cuba ingat Tuhan"""" , """"Aku pon lalui benda macam kau,  lagi teruk drpd kau lagi"""" ","['tetapi', 'tindak', 'balas', 'dia', 'cuba', 'kepada', 'berfikir', 'positif', 'cuba', 'ingat', 'tuh', 'aku', 'pun', 'lalu', 'benda', 'macam', 'kamu', 'lagi', 'teruk', 'daripada', 'kamu', 'lagi']",risk factor
1083, Hmm,['hm'],non-deppressive
1084," Kalau dapat dah dapat respond sebegitu, kau rasa aku tak lagi stress ke","['kalau', 'dapat', 'dah', 'dapat', 'balas', 'begitu', 'kamu', 'rasa', 'aku', 'tidak', 'lagi', 'tres', 'ke']",non-deppressive
1085, Orang yang tak pernah lalui depression tak faham apa itu depression,"['orang', 'yang', 'tidak', 'mengaparna', 'lalu', 'murung', 'tidak', 'faham', 'apa', 'itu', 'murung']",non-deppressive
1086," Mereka fikir kami sedih dan loser, tak ingat Tuhan, lemah Iman","['mereka', 'fikir', 'kami', 'sedih', 'dan', 'yang', 'ka', 'tidak', 'ingat', 'tuh', 'lemah', 'im']",symptom
1087, Haha,['haha'],non-deppressive
1088," Ntah la aku penat dengan dunia ni,  penat hidup","['en', 'aku', 'penat', 'deng', 'dunia', 'ini', 'penat', 'hidup']",symptom
1089," Aku ada je pergi kaunseling, makan antidepressants tapi the negative thoughts still datang","['aku', 'ada', 'sahaja', 'pergi', 'kaunseling', 'ma', 'antidepressant', 'tetapi', 'yang', 'negatif', 'thoughts', 'masih', 'ada', 'datang']",symptom
1090,  Aku still rse nak cederakan diri aku,"['aku', 'masih', 'ada', 'risa', 'nak', 'cedera', 'diri', 'aku']",symptom
1091,"  In fact semalam aku try untuk cederakan diri aku,  but amazingly tak rasa sakit","['masuk', 'fact', 'malam', 'aku', 'cuba', 'untuk', 'cedera', 'diri', 'aku', 'tetapi', 'luar', 'biasa', 'tidak', 'rasa', 'sakit']",symptom
1092, Aku punya deria sakit macam dah hilang,"['aku', 'pu', 'dia', 'sakit', 'macam', 'dah', 'hilang']",symptom
1093, Aku dah tak tau nak buat macam mana,"['aku', 'dah', 'tidak', 'tahu', 'nak', 'buat', 'macam', 'mana']",non-deppressive
1094,  Nak suruh seek help from psychiatrist,"['nak', 'suruh', 'seokay', 'bantu', 'dari', 'psikiatri']",non-deppressive
1095," Aku dh buat,  ubat aku makan","['aku', 'dah', 'buat', 'ubat', 'aku', 'ma']",non-deppressive
1096," Yet, aku still rasa kosong, useless, helpless, rasa macam aku beban untuk semua orang","['lagi', 'aku', 'masih', 'ada', 'rasa', 'kosong', 'tidak', 'guna', 'tidak', 'daya', 'rasa', 'macam', 'aku', 'beb', 'untuk', 'semua', 'orang']",symptom
1097, Rasa macam aku menyusahkan orang,"['rasa', 'macam', 'aku', 'tusah', 'orang']",symptom
1098,  Rasa macam semua tak suka aku,"['rasa', 'macam', 'semua', 'tidak', 'suka', 'aku']",symptom
1099, Dan aku pun benci diri aku,"['dan', 'aku', 'pun', 'benci', 'diri', 'aku']",symptom
1100, Aku penat,"['aku', 'penat']",symptom
1101, Penat hidup,"['penat', 'hidup']",symptom
1102," """,[],non-deppressive
1103,"""Rindu yang paling sakit ialah rindu kepada orang yang dah buang kita","['rindu', 'yang', 'paling', 'sakit', 'ia', 'rindu', 'kepada', 'orang', 'yang', 'dah', 'buang', 'k']",risk factor
1104," Maafkan saya, saya sedang merindui ibu saya","['maaf', 'saya', 'saya', 'sedang', 'rindu', 'ibu', 'saya']",non-deppressive
1105," Doakan ibu saya sihat selalu, doakan dia diberi ketenangan, doakan dia dilembutkan hati untuk memaafkan anak-anaknya, doakan dia dapat menerima sebuah kenyataan (walaupun kenyataan itu sakit untuk diterima)","['doa', 'ibu', 'saya', 'sihat', 'selalu', 'doa', 'dia', 'beri', 'ten', 'doa', 'dia', 'lembut', 'hati', 'untuk', 'memuefa', 'anak', 'anak', 'doa', 'dia', 'dapat', 'terima', 'buah', 'nyata', 'walaupun', 'nyata', 'itu', 'sakit', 'untuk', 'terima']",non-deppressive
1106,"Mungkin dalam ramai ramai yang membaca posting ini, boleh mengaminkan doa diatas","['mungkin', 'dalam', 'ramai', 'ramai', 'yang', 'baca', 'posting', 'ini', 'boleh', 'amin', 'doa', 'atas']",non-deppressive
1107," Sebab kita tak tahu, doa siapa yang Allah angkat dan makbulkan","['sebab', 'k', 'tidak', 'tahu', 'doa', 'siapa', 'yang', 'allah', 'angkat', 'dan', 'makbul']",non-deppressive
1108,"Thanks""",['thanks'],non-deppressive
1109,Hi nak tanya,"['hi', 'nak', 'tanya']",non-deppressive
